"judul","penulis","penerbit","kota","tahun","isbn","cover_url","baca_url","kategori"
"Sastra bugis klasik","Nur Azizah Syahril Nur Azizah Syahril","Pusat Pembinaan dan Pengembangan Bahasa","-","2017","979-459-919-0","-","http://repositori.kemendikdasmen.go.id/id/eprint/3501","800 Sastra"
"Sastra Bukan Penjara Bagi Bahasa (2004)","-","BAGIAN PROYEK PEMBINAAN BAHASA DAN SASTRA","-","2017","979.685.438-4","-","http://repositori.kemendikdasmen.go.id/2094/1/Sastra%20Bukan%20Penjara%20Bagi%20Bahasa%20%282004%29.pdf","800 Sastra"
"Sastra Bukan Penjara Bagi Bahasa 2004 154","Umar Sidik Umar Sidik","BAGIAN PROYEK PEMBINAAN BAHASA DAN SASTRA","-","2017","979.685.438-4","-","http://repositori.kemendikdasmen.go.id/3503/1/Sastra%20Bukan%20Penjara%20Bagi%20Bahasa%202004%20%20%20154.pdf","800 Sastra"
"Sastra daerah Bugis dan Makassar sebagai kekuatan kultural dalam membangun budaya bangsa Indonesia","Besse Darmawati (bessedarmawaty@gmail.com)","Badan Pengembangan dan Pembinaan Bahasa","-","2019","-","-","http://repositori.kemendikdasmen.go.id/id/eprint/10097","800 Sastra"
"Sastra Daerah Di Nusa Tenggara Barat Analisis.Tema,Amanat &amp; Nilai Budaya (1998)","Edwar Djamaris Edwar Djamaris","-","-","2017","-","-","http://repositori.kemendikdasmen.go.id/id/eprint/2095","800 Sastra"
"Sastra dan perdamaian dalam bingkai kesadaran identitas : refleksi kebangkitan sastra lokal Maluku pascakonflik 1999","Falantino Eryk Latupapua (falantinoeryk2@gmail.com)","Badan Pengembangan dan Pembinaan Bahasa","-","2019","-","-","http://repositori.kemendikdasmen.go.id/11001/1/SASTRA%20DAN%20PERDAMAIAN%20DALAM%20BINGKAI%20KESADARAN%20IDENTITAS.pdf","800 Sastra"
"Sastra Jawa Modern Periode 1920 Sampai Perang Kemerdekaan (1996)","Tirto Suwondo Tirto Suwondo","Pusat Pembinaan dan Pengembangan Bahasa","-","2017","979-459-667-1","-","http://repositori.kemendikdasmen.go.id/id/eprint/2098","800 Sastra"
"Sastra Jawa Modern Periode 1945-1965 (1997)","Imam Budi Utomo Imam Budi Utomo","Pusat Pembinaan dan Pengembangan Bahasa","-","2017","979 459 761 9","-","http://repositori.kemendikdasmen.go.id/2099/1/Sastra%20Jawa%20Modern%20Periode%201945-1965%20%281997%29.pdf","800 Sastra"
"Sastra keagamaan dalam perkembangan sastra Indonesia: puisi 1946-1965","Dwi Pratiwi","Pusat Bahasa Departemen Pendidikan Nasional","-","2020","979-685-440-6","-","http://repositori.kemendikdasmen.go.id/id/eprint/16139","800 Sastra"
"SASTRA LISAN GAYO","M. Dahlan M. Dahlan","Pusat Pembinaan dan Pengembangan Bahasa","-","2017","-","-","http://repositori.kemendikdasmen.go.id/3502/1/SASTRA%20LISAN%20%20GAYO.pdf","800 Sastra"
"Sastra Lisan Aceh","Araby Ahmad Araby Ahmad","Pusat Pembinaan dan Pengembangan Bahasa","-","2017","-","-","http://repositori.kemendikdasmen.go.id/3504/1/Sastra%20Lisan%20Aceh.pdf","800 Sastra"
"Sastra Lisan Bahasa Melayu Belitung","Zainal Arifin Aliana Zainal Arifin Aliana","Pusat Pembinaan dan Pengembangan Bahasa","-","2017","979 459 199 8","-","http://repositori.kemendikdasmen.go.id/3505/1/Sastra%20Lisan%20Bahasa%20Melayu%20Belitung.pdf","800 Sastra"
"Sastra lisan bolaang mongondow","Nadjamuddin-Tome Nadjamuddin-Tome","PUSAT PEMBINAAN DAN PENGEMBANGAN BAHASA","-","2017","-","-","http://repositori.kemendikdasmen.go.id/3506/1/Sastra%20lisan%20bolaang%20mongondow.pdf","800 Sastra"
"Sastra Lisan Bugis","Fachruddin Fachruddin","Pusat Pembinaan dan Pengembangan Bahasa","-","2017","-","-","http://repositori.kemendikdasmen.go.id/3507/1/Sastra%20Lisan%20Bugis.pdf","800 Sastra"
"Sastra lisan Dairi: inventarisasi dan analisis ragam prosa","Yunita Agnes Sianipar","Pusat Pembinaan dan Pengembangan Bahasa","-","2023","9794596701","-","http://repositori.kemendikdasmen.go.id/26473/1/Sastra%20Lisan%20Dairi%20Inventarisasi%20dan%20Analisis%20Ragam%20Prosa%201996.pdf","800 Sastra"
"Sastra lisan dayak ngaju","M. Rus Andianto M. Rus Andianto","Pusal Pembinaan dan Pengembangan Bahasa","-","2017","-","-","http://repositori.kemendikdasmen.go.id/3509/1/Sastra%20lisan%20dayak%20ngaju.pdf","800 Sastra"
"Sastra Lisan Donggo","Ni Putu Asmarini Ni Putu Asmarini","Pusat Pembinaan dan Pengembangan Bahasa","-","2017","979-459-843-7","-","http://repositori.kemendikdasmen.go.id/3510/1/Sastra%20Lisan%20Donggo.pdf","800 Sastra"
"Sastra lisan Ekagi","Wigati Y. Modouw","Pusat Pembinaan dan Pengembangan Bahasa","-","2023","9794598526","-","http://repositori.kemendikdasmen.go.id/27426/1/SASTRA%20LISAN%20EKAGI.pdf","800 Sastra"
"Sastra lisan Gayo","Amir Daut","Pusat Pembinaan dan Pengembangan Bahasa","-","2023","-","-","http://repositori.kemendikdasmen.go.id/27428/1/SASTRA%20LISAN%20GAYO.pdf","800 Sastra"
"SASTRA LISAN JAWA","Suyono Suyono","Pusat Pembinaan dan Pengembangan Bahasa","-","2017","-","-","http://repositori.kemendikdasmen.go.id/3511/1/SASTRA%20LISAN%20JAWA.pdf","800 Sastra"
"SASTRA LISAN KARO","Tahir Sitepu Tahir Sitepu","Pusat Pembinaan dan Pengembangan Bahasa","-","2017","979-459-311- 7","-","http://repositori.kemendikdasmen.go.id/3512/1/SASTRA%20LISAN%20KARO.pdf","800 Sastra"
"Sastra lisan kayaan","Paternus Hanye Paternus Hanye","Pusat Pembinaan dan Pengembangan Bahasa","-","2017","979-459-828-3","-","http://repositori.kemendikdasmen.go.id/3513/1/Sastra%20lisan%20kayaan.pdf","800 Sastra"
"SASTRA LISAN KAYU AGUNG","Zainal Abidin Gaffar Zainal Abidin Gaffar","Departemen Pendidikan dan Kebudayaan","-","2017","979 459 115 7","-","http://repositori.kemendikdasmen.go.id/id/eprint/3514","800 Sastra"
"Sastra Lisan Lampung Dialek Pubiyan","Warnidah Akhyar Warnidah Akhyar","Pusat Pembinaan dan Pengembangan Bahasa","-","2017","979-459-826-7","-","http://repositori.kemendikdasmen.go.id/3515/1/Sastra%20Lisan%20Lampung%20Dialek%20Pubiyan.pdf","800 Sastra"
"SASTRA LISAN MELAYU LANGKAT","Masindan Masindan","Pusat Pembinaan dan Pengembangan Bahasa","-","2017","-","-","http://repositori.kemendikdasmen.go.id/3516/1/SASTRA%20LISAN%20MELAYU%20LANGKAT.pdf","800 Sastra"
"Sastra Lisan Mentawai","Mustafa G. Mustafa G.","Pusat Pembinaan dan Pengembangan Bahasa","-","2017","979-459-360-0","-","http://repositori.kemendikdasmen.go.id/3517/1/Sastra%20Lisan%20Mentawai.pdf","800 Sastra"
"SASTRA LISAN MINANGKABAU-TRADISI PASAMBAHAN PADA UPACARA KEMATIAN","Syamsuddin Udin Syamsuddin Udin","Departemen Pendidikan dan Kebudayaan","-","2017","979 459 0290","-","http://repositori.kemendikdasmen.go.id/3518/1/SASTRA%20LISAN%20MINANGKABAU-TRADISI%20PASAMBAHAN%20PADA%20UPACARA%20KEMATIAN.pdf","800 Sastra"
"Sastra lisan Ngadha di Bajawa","Alex A. Kabelen","Pusat Pembinaan dan Pengembangan Bahasa","-","2023","9794599883","-","http://repositori.kemendikdasmen.go.id/27430/1/SASTRA%20LISAN%20NGADHA%20DI%20BAJAWA.pdf","800 Sastra"
"Sastra lisan Ogan","Hasfi Yusuf","Pusat Pembinaan Dan Pengembangan Bahasa Departemen Pendidikan Dan Kebudayaan","-","2022","-","-","http://repositori.kemendikdasmen.go.id/23916/1/SASTRA%20LISAN%20OGAN.pdf","800 Sastra"
"Sastra Lisan Prosa Bugis","M. Arief Mattaliti M. Arief Mattaliti","Departemen Pendidikan dan Kebudayaan","-","2017","979-459-059-2","-","http://repositori.kemendikdasmen.go.id/3520/1/Sastra%20Lisan%20Prosa%20Bugis.pdf","800 Sastra"
"SASTRA LISAN SALUAN","Ahmad Saro Ahmad Saro","Departemen Pendidikan dan Kebudayaan","-","2017","979 459 034 7","-","http://repositori.kemendikdasmen.go.id/id/eprint/3521","800 Sastra"
"Sastra Lisan sambas. teks, Struktur, dan Lingkungan Penceritaan (1993)","Chairil Effendy Chairil Effendy","Pusat Pembinaan dan Pengembangan Bahasa","-","2017","979-459-291-9","-","http://repositori.kemendikdasmen.go.id/2105/1/Sastra%20Lisan%20sambas.%20teks%2C%20Struktur%2C%20dan%20Lingkungan%20Penceritaan%20%281993%29.pdf","800 Sastra"
"Sastra lisan sangir talaud","Paul Nebarth Paul Nebarth","Pusat Pembinaan dan Pengembangan Bahasa","-","2017","-","-","http://repositori.kemendikdasmen.go.id/3522/1/Sastra%20lisan%20sangir%20talaud.pdf","800 Sastra"
"Sastra Lisan Simalungun","Anni Krisna Siregar","Pusat Pembinaan dan Pengembangan Bahasa","-","2017","-","-","http://repositori.kemendikdasmen.go.id/4541/1/Sastra%20Lisan%20Simalungun.pdf","800 Sastra"
"Sastra Lisan Simalungun (1986)","Anni Krisna Siregar Anni Krisna Siregar","Pusat Pembinaan dan Pengembangan Bahasa","-","2017","-","-","http://repositori.kemendikdasmen.go.id/2106/1/Sastra%20Lisan%20Simalungun%20%281986%29.pdf","800 Sastra"
"SASTRA LISAN SUNDA-CERITERA KARUHUN-KAJAJADEN-DEDEMIT","YasRusyana YasRusyana","Pusat Pembinaan dan Pengembangan Bahasa","-","2017","-","-","http://repositori.kemendikdasmen.go.id/3523/1/SASTRA%20LISAN%20SUNDA-CERITERA%20KARUHUN-KAJAJADEN-DEDEMIT.pdf","800 Sastra"
"SASTRA LISAN SUNDA-MITE FABEL DAN LEGENDE","Yetty Kuamiyati Hadiah Yetty Kuamiyati Hadiah","Pusat Pembinaan dan Pengembangan Bahasa","-","2017","-","-","http://repositori.kemendikdasmen.go.id/id/eprint/3524","800 Sastra"
"Sastra Lisan Tanimbar II","Djamari Djamari","Pusat Pembinaan dan Pengembangan Bahasa","-","2017","-","-","http://repositori.kemendikdasmen.go.id/id/eprint/3525","800 Sastra"
"Sastra lisan Ternate : analisis struktur dan nilai budaya","W. Piris","Badan Pengembangan dan Pembinaan Bahasa","-","2020","979-685-083-4","-","http://repositori.kemendikdasmen.go.id/18922/1/bbs_WQTJGPJB_1573711352.pdf","800 Sastra"
"Sastra lisan ternate analisis struktur dan nilai budaya","W. Piris - P W. Piris - P","Pusat Bahasa Departemen Pendidikan Nasional","-","2017","-","-","http://repositori.kemendikdasmen.go.id/id/eprint/3526","800 Sastra"
"SASTRA LISAN TETUN","I Nyoman Suarjana I Nyoman Suarjana","Pusat Pembinaan dan Pengembangan Bahasa","-","2017","979-459-505-5","-","http://repositori.kemendikdasmen.go.id/id/eprint/3528","800 Sastra"
"Sastra Lisan Tetun Belu Analisis Struktur dan Nilai Budaya","I Made Sugiarga I Made Sugiarga","Pusat Pembinaan dan Pengembangan Bahasa","-","2017","-","-","http://repositori.kemendikdasmen.go.id/3527/1/Sastra%20Lisan%20Tetun%20Belu%20Analisis%20Struktur%20dan%20Nilai%20Budaya.pdf","800 Sastra"
"Sastra Lisan Tolaki 2007 158","Rahmawati Rahmawati","KANTOR BAHASA PROVINSI SULAWESI TENGGARA","-","2017","978 979 685 612 1","-","http://repositori.kemendikdasmen.go.id/3529/1/Sastra%20Lisan%20Tolaki%202007%20%20%20%20%20158.pdf","800 Sastra"
"Sastra lisan Toloq Mandar","Abdul Muthalib","Pusat Pembinaan dan Pengembangan Bahasa","-","2023","9794593826","-","http://repositori.kemendikdasmen.go.id/27431/1/SASTRA%20LISAN%20TOLOQ%20MANDAR.pdf","800 Sastra"
"Sastra lisan Totoli","Dahlan Kadjia","Pusat Pembinaan dan Pengembangan Bahasa","-","2017","9794595160","-","http://repositori.kemendikdasmen.go.id/3530/1/Sastra%20lisan%20totoli.pdf","800 Sastra"
"Sastra Makassar klasik","Sahabuddin Nappu","Pusat Pembinaan dan Pengembangan Bahasa","-","2023","979459329X","-","http://repositori.kemendikdasmen.go.id/27432/1/SASTRA%20MAKASSAR%20KLASIK.pdf","800 Sastra"
"Sastra Massenrempulu klasik","J.S. Sande","Pusat Pembinaan dan Pengembangan Bahasa","-","2023","979459394X","-","http://repositori.kemendikdasmen.go.id/26312/1/Sastra%20Massenrempulu%20Klasik%201994.pdf","800 Sastra"
"Sastra Miruda Tahun 1999 121a","Agus Sri Danardana Agus Sri Danardana","Pusat Pembinaan dan Pengembangan Bahasa","-","2017","-","-","http://repositori.kemendikdasmen.go.id/3531/1/Sastra%20Miruda%20Tahun%201999%20%20%20121a.pdf","800 Sastra"
"Sastra Toraja dan terjemahannya","J.S. Sande","Pusat Pengembangan dan Pembinaan Bahasa, Departemen Pendidikan dan Kebudayaan","-","2022","9794591459","-","http://repositori.kemendikdasmen.go.id/id/eprint/24536","800 Sastra"
"Sastra Toraja dan terjemahannya (1990)","J.S. Sande J.S. Sande","Departemen Pendidikan dan Kebudayaan","-","2017","979 459 1459","-","http://repositori.kemendikdasmen.go.id/2113/1/Sastra%20Toraja%20%26%20terjemahannya%20%281990%29.pdf","800 Sastra"
"Sastra untuk negeriku","Kasijanto Kasijanto","Museum Sumpah Pemuda","-","2022","979989980X","-","http://repositori.kemendikdasmen.go.id/24542/1/SASTRA%20UNTUK%20NEGERIKU.pdf","800 Sastra"
"Sastra yantra karya Anak Agung istri Biang Agung","I Nyoman Sulaga","Proyek Penelitian dan Pengkajian Kebudayaan Bali, Departemen Pendidikan dan Kebudayaan","-","2022","-","-","http://repositori.kemendikdasmen.go.id/24543/1/SASTRA%20YANTRA%20KARYA%20ANAK%20AGUNG%20ISTRI%20BIANG%20AGUNG.pdf","800 Sastra"
"Sastrawan Indonesia Gus tf Sakai Penerima Hadiah Sastra Asia Tenggara 2004","Gus tfSakai Gus tfSakai","PUSAT BAHASA DEPARTEMEN PENDIDIKAN NASIONAL","-","2017","-","-","http://repositori.kemendikdasmen.go.id/3532/1/Sastrawan%20Indonesia%20Gus%20tf%20Sakai%20Penerima%20Hadiah%20Sastra%20Asia%20Tenggara%202004.pdf","800 Sastra"
"Sastrawan Indonesia Hamsad Rangkuti Penerima Hadiah Sastra Asia Tenggara 2008","HAMSAD RANGKUTI HAMSAD RANGKUTI","PUSAT BAHASA DEPARTEMEN PENDIDIKAN NASIONAL","-","2017","978-979-685-775-3","-","http://repositori.kemendikdasmen.go.id/id/eprint/3533","800 Sastra"
"Sastrawan Indonesia NH. Dini: penerima hadiah Sastra Asia Tenggara / Indonesian Writer NH. Dini: awardee of The South East Asia Write Awards 2003","Dwi Pratiwi","Pusat Bahasa Departemen Pendidikan Nasional","-","2021","9796853124","-","http://repositori.kemendikdasmen.go.id/23627/1/SASTRAWAN%20INDONESIA%20INDONESIAN%20WRITER%20NH.%20DINI.pdf","800 Sastra"
"Sastrawan Indonesia Rendra penerima hadiah Sastra Asia Tenggara 1996 = Indonesian writer awardee of the S.E.A. write awards","Pusat Pembinaan dan Pengembangan Bahasa Pusat Pembinaan dan Pengembangan Bahasa","Pusat Pembinaan dan Pengembangan Bahasa","-","2017","9794597023","-","http://repositori.kemendikdasmen.go.id/3535/1/Sastrawan%20Indonesia%20Rendra%20Penerima%20Hadiah%20Sastra%20Asia%20Tenggara%201996.pdf","800 Sastra"
"Sastrawan Indonesia Sitor Situmorang. Penerima hadiah Sastra Asia Tenggara 2006 = Indonesian Writer Awardee of the S.E.A. Write Award 2006","Pusat Bahasa Pusat Bahasa","Pusat Bahasa, Departemen Pendidikan Nasional","-","2017","9796855801","-","http://repositori.kemendikdasmen.go.id/id/eprint/3534","800 Sastra"
"Sastrawan Indonesia Suparto Brata Penerima Hadiah Sastra Asia Tenggara 2007","SUPARTO BRATA SUPARTO BRATA","Pusat Bahasa Departemen Pendidikan Nasional","-","2017","978-979-685-680-0","-","http://repositori.kemendikdasmen.go.id/3536/1/Sastrawan%20Indonesia%20Suparto%20Brata%20Penerima%20Hadiah%20Sastra%20Asia%20Tenggara%202007.pdf","800 Sastra"
"Sastrawan Indonesia Wisran Hadi","-","Pusat Bahasa","-","2023","9796851245","-","http://repositori.kemendikdasmen.go.id/26314/1/sastrawan%20indonesia%20wisran%20hadi%202000.pdf","800 Sastra"
"Sastrawan Indonesia Writer (2007)","SUPARTO BRATA SUPARTO BRATA","Pusat Bahasa Departemen Pendidikan Nasional","-","2017","978-979-685-680-0","-","http://repositori.kemendikdasmen.go.id/id/eprint/2114","800 Sastra"
"Sastrawan Indonesia: Darmanto Jatman, penerima hadiah Sastra Asia Tenggara / Indonesian Writer: Darmanto Jatman, awardee of The South East Asia Write Awards 2002","Adriani Soemantri","Pusat Bahasa Departemen Pendidikan Nasional","-","2021","9796852268","-","http://repositori.kemendikdasmen.go.id/23599/1/SASTRAWAN%20INDONESIA%20INDONESIAN%20WRITER%20DARMANTO%20JATMAN.PDF","800 Sastra"
"Sastrawan Indonesia: Gus tf Sakai; penerima hadiah sastra Asia Tenggara 2004","Jonner Sianipar","Pusat Bahasa","-","2023","979685404X","-","http://repositori.kemendikdasmen.go.id/26474/1/Sastrawan%20Indonesia%20Gus%20Tf%20Sakai%202004.pdf","800 Sastra"
"Sastrawan Indononesia (2008)","HAMSAD RANGKUTI HAMSAD RANGKUTI","Pusat Bahasa Departemen Pendidikan Nasional","-","2017","978-979-685-775-3","-","http://repositori.kemendikdasmen.go.id/2115/1/Sastrawan%20Indononesia%20%282008%29.pdf","800 Sastra"
"Satai buah Talita","Cesilia Prawening","Balai Bahasa Jawa Tengah","-","2023","-","-","http://repositori.kemendikdasmen.go.id/26407/1/SATAI%20BUAH%20TALITA.pdf","800 Sastra"
"Satria dari astinapura","Nikmah Sunardjo Nikmah Sunardjo","Pusat Bahasa Kementerian Pendidikan Nasional","-","2017","978-979-069-013-4","-","http://repositori.kemendikdasmen.go.id/id/eprint/3537","800 Sastra"
"Satria Dari Plangkawati (1995)","Sarwono Sarwono","Pusat Pembinaan dan Pengembangan Bahasa","-","2017","979-459-55 9-4","-","http://repositori.kemendikdasmen.go.id/2116/1/Satria%20Dari%20Plangkawati%20%281995%29.pdf","800 Sastra"
"Satria dari pringgadani","Muhammad Djaruki Muhammad Djaruki","Pusat Bahasa Departemen Pendidikan Nasional","-","2017","979-685-534-8","-","http://repositori.kemendikdasmen.go.id/3538/1/Satria%20dari%20pringgadani.pdf","800 Sastra"
"Satria pamungkas majapahit","Imam Budi Utomo Imam Budi Utomo","Pusat Bahasa Departemen Pendidikan Nasional","-","2017","978-979-685-644-2","-","http://repositori.kemendikdasmen.go.id/3539/1/Satria%20pamungkas%20majapahit.pdf","800 Sastra"
"Satria tanpa tanding","Ebah Suhaebah","Pusat Bahasa, Departemen Pendidikan Nasional","-","2017","9794590303","-","http://repositori.kemendikdasmen.go.id/3540/1/Satria%20tanpa%20tanding.pdf","800 Sastra"
"Satua-Satua Bali (2011)","I Nengah Tinggen I Nengah Tinggen","BALAl BAHASA DENPASAR","-","2017","978-602-19066-5-1","-","http://repositori.kemendikdasmen.go.id/2118/1/Satua-Satua%20Bali%20%282011%29.pdf","800 Sastra"
"Saussure","Rochayah Rochayah","Pusat Pembinaan dan Pengembangan Bahasa","-","2017","-","-","http://repositori.kemendikdasmen.go.id/3542/1/Saussure.pdf","800 Sastra"
"Sawerigading . memuat masalah bahasa dan sastra Indonesia dan daerah. No 1","Abdul Kadir Mulya","Balai Penelitian Bahasa Provinsi Sulawesi Selatan","-","2023","-","-","http://repositori.kemendikdasmen.go.id/26315/1/sawerigading%20nomor%201%20maret%201993.pdf","800 Sastra"
"Sawerigading: jurnal bahasa dan sastra volume 28, nomor 1, Juni 2022","Suryadi Suryadi","Balai Bahasa  Sulawesi Selatan","-","2023","8544220","-","http://repositori.kemendikdasmen.go.id/29159/1/1.%20Sawerigading%2C%20Vol.28%2C%20Nomor%201%20Juni%202022.pdf","800 Sastra"
"Sawerigading: memuat masalah bahasa dan sastra Indonesia dan daerah","Abdul Kadir Mulya","Balai Bahasa  Sulawesi Selatan","-","2023","-","-","http://repositori.kemendikdasmen.go.id/29199/1/Sawerigading%20Nomor%201%2C%20Maret%201993.pdf","800 Sastra"
"Sawรฉran, haren = Saweran seru","Efa Refnita","Kantor Bahasa Provinsi Banten","-","2026","9786235042220","-","http://repositori.kemendikdasmen.go.id/34527/1/%28Cetak%29%20Saweran%20Seru.pdf","800 Sastra"
"Sayangi alam","Syahri Sutan Turunan Migo","Kantor Bahasa Provinsi Lampung","-","2025","-","-","http://repositori.kemendikdasmen.go.id/32838/1/Sayangi-Alam.pdf","800 Sastra"
"Seawรฉt iwak gรฉsรฉk = Seawet ikan asin","Fajar Timur","Kantor Bahasa Provinsi Banten","-","2026","9786340009514","-","http://repositori.kemendikdasmen.go.id/34604/1/%28Cetak%29%20Seawet%20Ikan%20Asin.pdf","800 Sastra"
"Sebuah Pengampun Cinta","Zaenal Hakim Zaenal Hakim","Pusat Bahasa Kementerian Pendidikan Nasional","-","2017","978-979ยท069-030-1","-","http://repositori.kemendikdasmen.go.id/3541/1/Sebuah%20Pengampun%20Cinta.pdf","800 Sastra"
"Sebuah pengampunan cinta","Zaenal Hakim","Pusat Bahasa Badan Pengembangan dan Pembinaan Bahasa Kementerian Pendidikan Dan Kebudayaan","-","2021","9790690301","-","http://repositori.kemendikdasmen.go.id/23629/1/SEBUAH%20PENGAMPUNAN%20CINTA.PDF","800 Sastra"
"Sejarah alquran tarikh alquran","Ramli Harun Ramli Harun","Pusat Pembinaan dan Pengembangan Bahasa","-","2017","979.459.652-3","-","http://repositori.kemendikdasmen.go.id/3543/1/Sejarah%20alquran%20tarikh%20alquran.pdf","800 Sastra"
"Sejarah daerah Sumatera Barat","Mardjani Martamin","Proyek Penerbitan Buku Bacaan dan Sastra Indonesia dan Daerah, Departemen Pendidikan dan Kebudayaan","-","2022","-","-","http://repositori.kemendikdasmen.go.id/24640/1/SEJARAH%20DAERAH%20SUMATRA%20BARAT.pdf","800 Sastra"
"Sejarah dan Perkembangan Pusat Pembinaan dan Pengembangan Bahasa","halim amran","Pusat Pembinaan dan ยทPengembangan Bahasa","-","2017","-","-","http://repositori.kemendikdasmen.go.id/id/eprint/3546","800 Sastra"
"Sejarah dan perkembangan sastra Indonesia di Maluku","D. Gaspersz D. Gaspersz","Pusat Bahasa, Departemen Pendidikan Nasional","-","2020","9796851261","-","http://repositori.kemendikdasmen.go.id/16140/1/Sejarah%20dan%20Perkembangan%20Sastra%20Indonesia%20di%20Maluku%202000.pdf","800 Sastra"
"Sejarah empu","Proyek Media Kebudayaan Jakarta Proyek Media Kebudayaan Jakarta","Proyek Media Kebudayaan Jakarta","-","2024","-","-","http://repositori.kemendikdasmen.go.id/29789/1/SEJARAH%20EMPU.PDF","800 Sastra"
"Sejarah kebudayaan Indonesia 6: bahasa, sastra dan aksara","Yoesoef Yoesoef","Direktorat Geografi Sejarah","-","2023","-","-","http://repositori.kemendikdasmen.go.id/27466/1/SEJARAH%20KEBUDAYAAN%20INDONESIA%20JILID%206%20%28BAHASA%2CSASTRA%20DAN%20AKSARA%29.pdf","800 Sastra"
"Sejarah kebudayaan Indonesia: seri bahasa, sastra dan aksara","Munawar Holil","Departemen Kebudayaan dan Pariwisata","-","2023","-","-","http://repositori.kemendikdasmen.go.id/27467/1/SEJARAH%20KEBUDAYAAN%20INDONESIA%20SERI%20BAHASA%2CSASTRA%20DAN%20AKSARA.pdf","800 Sastra"
"Sejarah Melayu Sebagai Karya Sastra &amp;Karya Sejarah Sebuah Antologi (2005)","Budiono Isas Budiono Isas","-","-","2017","-","-","http://repositori.kemendikdasmen.go.id/2125/1/Sejarah%20Melayu%20Sebagai%20Karya%20Sastra%20%26Karya%20Sejarah%20Sebuah%20Antologi%20%282005%29.pdf","800 Sastra"
"Sejarah Melayu sebagai karya sastra dan karya sejarah : sebuah antologi","Budiono Isas","Pusat Bahasa, Departemen Pendidikan Nasional","-","2022","9796855240","-","http://repositori.kemendikdasmen.go.id/id/eprint/24845","800 Sastra"
"Sejarah pertumbuhan sastra indonesia di Jawa Barat","Erni Nurtiningsih","Pusat Pembinaan Dan Pengembangan Bahasa","-","2022","9794590053","-","http://repositori.kemendikdasmen.go.id/23809/1/SEJARAH%20PERTUMBUHAN%20SASTRA%20INDONESIA%20DI%20JAWA%20BARAT.pdf","800 Sastra"
"Sekaten","Sri Winarti","Balai Bahasa Provinsi Daerah Istimewa Yogyakarta","-","2023","9786235677354","-","http://repositori.kemendikdasmen.go.id/28694/1/12-sekaten.pdf","800 Sastra"
"Seluk Beluk Morfologi Bahasa Sunda 69","E. Zaenal Arifin E. Zaenal Arifin","Pusat Pembinaan dan Pengembangan Bahasa","-","2017","-","-","http://repositori.kemendikdasmen.go.id/3548/1/Seluk%20Beluk%20Morfologi%20Bahasa%20Sunda%20%20%2069.pdf","800 Sastra"
"Semantik Bahasa Batak Toba 2003 124","Robert Sibarani Robert Sibarani","PUSAT BAHASA DEPARTEMEN PENDIDlKAN NASIONAL","-","2017","-","-","http://repositori.kemendikdasmen.go.id/3550/1/Semantik%20Bahasa%20Batak%20Toba%202003%20%20124.pdf","800 Sastra"
"Sembesat sembesit: kumpulan cerita rakyat Sumatera Selatan","Muslim Muslim","Balai Bahasa Sumatera Selatan","-","2022","9799627923","-","http://repositori.kemendikdasmen.go.id/id/eprint/26082","800 Sastra"
"Seminar Nasional Bahasa Dan Sastra 2011 (2011)","Arief Rachman Arief Rachman","Kantor Bahasa Provinsi NTB","-","2017","-","-","http://repositori.kemendikdasmen.go.id/2132/1/Seminar%20Nasional%20Bahasa%20Dan%20Sastra%202011%20%282011%29.pdf","800 Sastra"
"Seminar nasional bahasa dan sastra membangun karakter bangsa dalam pluralisme budaya","Nining Nur Alaini Nining Nur Alaini","PANITIA SEMINAR BAHASA DAN SASTRA","-","2017","-","-","http://repositori.kemendikdasmen.go.id/3552/1/Seminar%20nasional%20bahasa%20dan%20sastra%20membangun%20karakter%20bangsa%20dalam%20pluralisme%20budaya.pdf","800 Sastra"
"Seminar penulisan bahan pengajaran bahasa yogyakarta 30 mei 4 juni 1983","S.R.H. Sitanggang S.R.H. Sitanggang","Punt Pembinaaan dan Pengembangan Bahasa","-","2017","-","-","http://repositori.kemendikdasmen.go.id/3551/1/Seminar%20penulisan%20bahan%20pengajaran%20bahasa%20yogyakarta%2030%20mei%204%20juni%201983.pdf","800 Sastra"
"Seminar sejarah lokal: sastra dan sejarah lokal","Sri Wulan Rujiati Mulyadi","Direktorat Jenderal Kebudayaan","-","2019","-","-","http://repositori.kemendikdasmen.go.id/13435/1/Seminar%20sejarah%20lokal%20sastra%20dan%20sejarah%20lokal.PDF","800 Sastra"
"SEMINAR TATA BAHASA BAKU BAHASA INDONESIA","S.R.H. Sitanggang S.R.H. Sitanggang","Departemen Pendidikan dan Kebudayaan","-","2017","-","-","http://repositori.kemendikdasmen.go.id/3553/1/SEMINAR%20TATA%20BAHASA%20BAKU%20BAHASA%20INDONESIA.pdf","800 Sastra"
"Semiotik dan penerapannya dalam karya sastra","Okke K.S. Zaimar","Pusat Bahasa, Departemen Pendidikan Nasional","-","2020","9789796857517","-","http://repositori.kemendikdasmen.go.id/16144/1/Semiotik%20dan%20Penerapannya%20dalam%20Karya%20Sastra%202008.pdf","800 Sastra"
"Senandung sunyi di pucuk trembesi: antologi cerpen bengkel bahasa dan sastra Indonesia guru SLTP Kabupaten Bantul","Hariyanto Hariyanto","Balai Bahasa Daerah Istimewa Yogyakarta, Badan Pengembangan dan Penelitian Bahasa, Kementerian Pendidikan dan Kebudayaan","-","2020","9786026284297","-","http://repositori.kemendikdasmen.go.id/16145/1/Senandung%20Sunyi%20di%20Pucuk%20Trembesi%202016.pdf","800 Sastra"
"Senarai Kata Serapan Dalam Bahasa Indonesia","-","Pusat Pembinaan dan Pengembangan Bahasa","-","2017","-","-","http://repositori.kemendikdasmen.go.id/4383/1/Senarai%20Kata%20Serapan%20Dalam%20Bahasa%20Indonesia%201995.pdf","800 Sastra"
"Senarai kata serapan dalam bahasa indonesia","Hasan Alwi Hasan Alwi","Pusat Pembinaan dan Pengembangan Bahasa","-","2017","-","-","http://repositori.kemendikdasmen.go.id/id/eprint/3554","800 Sastra"
"Sengsara membawa nikmat jilid 1","Soetan Sati","Balai Bahasa Provinsi Daerah Istimewa Yogyakarta","-","2023","9786239567552","-","http://repositori.kemendikdasmen.go.id/28750/1/3-Sengsara%20Membawa%20Nikmat_1.pdf","800 Sastra"
"Sengsara membawa nikmat jilid 2","Soetan Sati","Balai Bahasa Provinsi Daerah Istimewa Yogyakarta","-","2023","9786239567552","-","http://repositori.kemendikdasmen.go.id/28751/1/4-Sengsara%20Membawa%20Nikmat_2.pdf","800 Sastra"
"Sengรฉn Mpok seniki Tรฉtรฉh = Dulu Mpok sekarang Teteh","Ummi Habibah","Kantor Bahasa Provinsi Banten","-","2026","9786340009736","-","http://repositori.kemendikdasmen.go.id/34560/1/%28Cetak%29%20Dulu%20Mpok%20Sekarang%20Teteh.pdf","800 Sastra"
