"judul","penulis","penerbit","kota","tahun","isbn","cover_url","baca_url","kategori"
"NIlai Religius Dalam Sastra Jawa Klasik","Siamet Riyadi Siamet Riyadi","BALAI PENELITIAN BAHASA","Yogyakarta","2017","979-459-857-7","-","http://repositori.kemendikdasmen.go.id/1555/1/NIlai%20Religius%20Dalam%20Sastra%20Jawa%20Klasik%20%281997%29.pdf","800 Sastra"
"Nilai-Nilai Budaya dalam Susastra Daerah sulawesi selatan","Muhammad Sikki Muhammad Sikki","Pusat Pembinaan dan Pengembangan Bahasa","-","2017","979 459 1 53 7","-","http://repositori.kemendikdasmen.go.id/3275/1/Nilai-Nilai%20Budaya%20dalam%20Susastra%20Daerah%20sulSel%20%20%20%20203h.pdf","800 Sastra"
"Nilai-nilai pendidikan dalam novel Serial Anak-anak Mamak karya Tere Liye","Endah Ariani Madusari (ariani_endah@yahoo.com)","PPPPTK Bahasa","-","2018","-","-","http://repositori.kemendikdasmen.go.id/8621/1/Jurnal%20Juni%202016%20art%204%20nilai....pdf","800 Sastra"
"Ninis ayun mantuk = Ninis ingin pulang","Silvie Mariana","Kantor Bahasa Provinsi Banten","Banten","2026","9786023589920","-","http://repositori.kemendikdasmen.go.id/34598/1/%28Cetak%29%20Ninis%20Ayun%20Mantuk.pdf","800 Sastra"
"Nitisastra","Poerbatjaraka Poerbatjaraka","Proyek Inventarisasi & Dokumentasi Sejarah Nasional","Jakarta","2023","-","-","http://repositori.kemendikdasmen.go.id/27225/1/NITISASTRA.pdf","800 Sastra"
"No Nggololio","Tjatjo T.S. Al Idrus","Balai Bahasa Sulawesi Tengah","Palu","2022","9786239739614","-","http://repositori.kemendikdasmen.go.id/25688/1/No%20Nggololio.pdf","800 Sastra"
"Nomina Bahasa Banjar 129h","Durdje Durassid Durdje Durassid","Pusat Pembinaan dan Pengembangan Bahasa","-","2017","979-459-833-X","-","http://repositori.kemendikdasmen.go.id/3276/1/Nomina%20Bahasa%20Banjar%20%20%20%20%20%20%20%20129h.pdf","800 Sastra"
"Nomina dan Adjektiva Bahasa Karo","Bujur Surbakti","Departemen Pendidikan dan Kebudayaan","Jakarta","2017","979 459 039 8","-","http://repositori.kemendikdasmen.go.id/4529/1/Nomina%20dan%20Adjektiva%20Bahasa%20Karo.pdf","800 Sastra"
"NOMINA DAN ADJEKTIVA BAHASA LAMPUNG DIALEK ABUNG","R. Sudrajat R. Sudrajat","Pusat Pembinaan dan Pengembangan Bahasa","-","2017","979-459-825-9","-","http://repositori.kemendikdasmen.go.id/3277/1/NOMINA%20DAN%20ADJEKTIVA%20BAHASA%20LAMPUNG%20DIALEK%20ABUNG.pdf","800 Sastra"
"Nomina Dan Pemakaiannya Dalam Bahasa Indonesia","Non Martis Non Martis","PUSAT BAHASA DEPARTEMEN PENDIDIKAN NASIONAL","Jakarta","2017","979-685-088-5","-","http://repositori.kemendikdasmen.go.id/1577/1/Nomina%20Dan%20Pemakaiannya%20Dalam%20Bahasa%20Indonesia%20%282000%29.pdf","800 Sastra"
"Nomina Dan Pemakaiannya Dalam Bahasa Indonesia","Non Martis Non Martis","PUSAT BAHASA DEPARTEMEN PENDIDIKAN NASIONAL","Jakarta","2017","979-685-088-5","-","http://repositori.kemendikdasmen.go.id/1558/1/Nomina%20Dan%20Pemakaiannya%20Dalam%20Bahasa%20Indonesia%20%282000%29.pdf","800 Sastra"
"Nomina, Promina, dan Numerallia dalam Bahasa Jawa","Dirgo Sabariyanto Dirgo Sabariyanto","Pusat Pembinaan dan Pengembangan Bahasa","-","2017","979-459-496-2","-","http://repositori.kemendikdasmen.go.id/3278/1/Nomina%2C%20Promina%2C%20dan%20Numerallia%20dalam%20Bahasa%20Jawa.pdf","800 Sastra"
"Nona Koelit Koetjing : antologi cerita pendek Indonesia periode awal (1870-1n - 1910-an)","Dwi Pratiwi","Pusat Bahasa","Jakarta","2023","9796855259","-","http://repositori.kemendikdasmen.go.id/26643/1/NONA%20KOELIT%20KOETJING.pdf","800 Sastra"
"Novel "orang-orang proyek": sejarah orde baru","Ramis Rauf (ramis.rauf01@gmail.com)","Badan Pengembangan dan Pembinaan Bahasa","Jakarta","2019","-","-","http://repositori.kemendikdasmen.go.id/9991/1/dokumen_makalah_1540361565.pdf","800 Sastra"
"Novel Bali Anyar Cokorda Darma 2008 96","I GUSTI PUTU ANTARA I GUSTI PUTU ANTARA","Balai Bahasa Denpasar","-","2017","978-979-685-952-8","-","http://repositori.kemendikdasmen.go.id/3279/1/Novel%20Bali%20Anyar%20Cokorda%20Darma%202008%20%20%2096.pdf","800 Sastra"
"Novel Indonesia 15 tahun sesudah kemerdekaan (1946-1960): telaah struktur estetika dan tema","B. Trisman","Pusat Bahasa Departemen Pendidikan Nasional","Jakarta","2022","9796850877","-","http://repositori.kemendikdasmen.go.id/id/eprint/23882","800 Sastra"
"Nu ngabรฉla lalay = Pembela kelelawar","Ginanjar Hambali","Kantor Bahasa Provinsi Banten","Banten","2026","9786235049663","-","http://repositori.kemendikdasmen.go.id/34540/1/%28Cetak%29%20Pembela%20Kelelawar.pdf","800 Sastra"
"Numeral classifier bahasa Minangkabau isolek Aia Bangih","Ria Febrina","Badan Pengembangan dan Pembinaan Bahasa","Jakarta","2019","-","-","http://repositori.kemendikdasmen.go.id/10122/1/dokumen_makalah_1540363865.pdf","800 Sastra"
"Nure-nure di Karo","Henry Guntur Tarigan","Proyek Penerbitan Buku Sastra Indonesia dan Daerah","Jakarta","2023","-","-","http://repositori.kemendikdasmen.go.id/27226/1/NURE-NURE%20DI%20KARO.pdf","800 Sastra"
"Nyai Balau : cerita rakyat dari Kalimantan Tengah","Tjak Basori","Badan Pengembangan dan Pembinaan Bahasa","Jakarta","2017","9786024370312","-","http://repositori.kemendikdasmen.go.id/4077/1/Cerita%20Nyai%20Balau%20comp.pdf","800 Sastra"
"Nyai Undang Ratu Rupawan dari Pulau Kupang : cerita rakyat Kalimantan Tengah","Ai Kurniati","Badan Pengembangan dan Pembinaan Bahasa","Jakarta","2017","9786024371357","-","http://repositori.kemendikdasmen.go.id/4078/1/Cerita%20Nyai%20Undang%20comp.pdf","800 Sastra"
"Nyanyian Air Mata: antologi pusis siswa SD se-DIY 2009","Heru Hartanta","Balai Bahasa Yogyakarta","Yogyakarta","2026","9789791881981","-","http://repositori.kemendikdasmen.go.id/34876/1/Nyanyian%20Air%20Mata.%20Antologi%20Puisi%20Siswa%20SD%20Se-DIY%202009.pdf","800 Sastra"
"Nyanyian alung","Tuti Adhayati","Badan Pengembangan Bahasa dan Perbukuan","Jakarta","2020","-","-","http://repositori.kemendikdasmen.go.id/17747/1/Tuti%20Adhayati-Nyanyian%20Alung.pdf","800 Sastra"
"Nyi Mas Sukmi dan saudaranya","R. Sungkawa","Proyek Inventarisasi dan Dokumentasi Sejarah Nasional","Jakarta","2023","-","-","http://repositori.kemendikdasmen.go.id/id/eprint/27227","800 Sastra"
"Nyi Rengganis dan taman Banjarsari : cerita rakyat dari Jawa Barat","Resti Nurfaidah","Badan Pengembangan dan Pembinaan Bahasa","Jakarta","2017","978-602-437-098-5","-","http://repositori.kemendikdasmen.go.id/id/eprint/4080","800 Sastra"
"Nyiaran Belut = Berburu Belut","Ripki Permana","Kantor Bahasa Provinsi Banten","Banten","2026","9786235047966","-","http://repositori.kemendikdasmen.go.id/34705/1/%28Cetak%29%20Berburu%20Belut.pdf","800 Sastra"
"Nyiaran konci = Teka teki kunci","Khairul Hakim","Kantor Bahasa Provinsi Banten","Banten","2026","9786023589906","-","http://repositori.kemendikdasmen.go.id/34690/1/%28Cetak%29%20Teka%20Teki%20Kunci.pdf","800 Sastra"
"Oase kerinduan: antologi puisi bengkel sastra Indonesia 2010","Lulu Nurcahyati","Balai Bahasa Yogyakarta","Yogyakarta","2025","9789790690666","-","http://repositori.kemendikdasmen.go.id/26487/1/Oase%20Kerinduan%20Antologi%20Puisi%20Bengkel%20Sastra%20Indonesia%202010%20Yogyakarta.pdf","800 Sastra"
"Obsesi pengarang periode Balai Pustaka","Emidar Emidar","Pusat Pembinaan dan Pengembangan Bahasa","Jakarta","2023","9794598216","-","http://repositori.kemendikdasmen.go.id/27228/1/OBSESI%20PENGARANG%20PERIODE%20BALAI%20PUSTAKA.pdf","800 Sastra"
"Ogoh-ogoh Komang","Ni Kadek Heni Sayukti","Badan Pengembangan Bahasa dan Perbukuan","Jakarta","2021","9786024377786","-","http://repositori.kemendikdasmen.go.id/23127/1/Ogoh-ogoh%20Komang%20%28Ni%20Kadek%20Heny%29_BLM.pdf","800 Sastra"
"Olahraga apakah aku?","Khulatul Mubarokah","Badan Pengembangan dan Pembinaan Bahasa","Jakarta","2020","9786024377724","-","http://repositori.kemendikdasmen.go.id/18225/1/Olahraga%20Apakah%20Aku%20%28Kayla%20Mubara%29.pdf","800 Sastra"
"Ombak laut selatan: antologi puisi bengkel bahasa dan sastra Indonesia siswa SLTA kabupaten Bantul","Fitri Merawati","Balai Bahasa Daerah Istimewa Yogyakarta","Yogyakarta","2026","9786026284808","-","http://repositori.kemendikdasmen.go.id/34821/1/Ombak%20Laut%20Selatan%20antologi%20puisi.pdf","800 Sastra"
"Orang Sakai sudah modern","Dina Amalia Susamto","Badan Pengembangan dan Pembinaan Bahasa","Jakarta","2019","9786024372798","-","http://repositori.kemendikdasmen.go.id/11067/1/Orang%20Sakai%20Sudah%20Modern%20%28Dina%20Amalia%20Susamto%29_0.pdf","800 Sastra"
"Orang-orang malang","Lukman Hakim","Balai Bahasa Provinsi Jawa Timur, Kementerian Pendidikan dan Kebudayaan","Sidoarjo","2022","9786028334570","-","http://repositori.kemendikdasmen.go.id/24826/1/orang-orang%20malang.pdf","800 Sastra"
"Orang-orang Malioboro: refleksi dan pemaknaan kiprah persada studi klub 1969-1977 di Yogyakarta","Yeyen Maryani","Pusat Bahasa","Jakarta","2025","9789790690288","-","http://repositori.kemendikdasmen.go.id/id/eprint/26488","800 Sastra"
"Orientasi nilai budaya tokoh wanita dalam novel Indonesia","Kusni Kusni","Proyek Pembinaan Bahasa dan Sastra Indonesia dan Daerah Pusat","Jakarta","2023","9794596728","-","http://repositori.kemendikdasmen.go.id/27229/1/ORIENTASI%20NILAI%20BUDAYA%20TOKOH%20WANITA%20DALAM%20NOVEL%20INDONESIA.pdf","800 Sastra"
"p0lisemi verba dalam bahasa melayu betawi 165h","Mar'ida Gahar'a Sir'egar Mar'ida Gahar'a Sir'egar","PUSAT BAHASA DEFARTEMEN FENDIDIKAN NASIONAL","-","2017","978-979-685-675-6","-","http://repositori.kemendikdasmen.go.id/3281/1/p0lisemi%20verba%20dalam%20bahasa%20melayu%20betawi%20%20%20%20%20%20165h.pdf","800 Sastra"
"Paeh di popotongan","M.K. Hardjakusuma","Departemen Pendidikan dan Kebudayaan","Jakarta","2022","-","-","http://repositori.kemendikdasmen.go.id/id/eprint/24086","800 Sastra"
"Pahat Pangot = Pahat Pangot","Eli Awaliah Roselinni","Kantor Bahasa Provinsi Banten","Banten","2026","9786235049601","-","http://repositori.kemendikdasmen.go.id/id/eprint/34538","800 Sastra"
"Pahlawan dan tokoh inspirasi Aceh","Hidayatullah Hidayatullah","Badan Pengembangan dan Pembinaan Bahasa","Jakarta","2019","9786024373221","-","http://repositori.kemendikdasmen.go.id/11061/1/Pahlawan%20dan%20Tokoh%20Inspirasi%20Aceh%20%28Hidayatullah%29.pdf","800 Sastra"
"Pahlawan iteuk = Pahlawan bertongkat","Ginanjar Hambali","Kantor Bahasa Provinsi Banten","Banten","2026","9786235042329","-","http://repositori.kemendikdasmen.go.id/34522/1/%28Cetak%29%20Pahlawan%20Bertongkat.pdf","800 Sastra"
"Pahlawan putih","GM. Sigit Nurcahyanto Adhi","Balai Bahasa Provinsi Daerah Istimewa Yogyakarta","Yogyakarta","2023","9786235677248","-","http://repositori.kemendikdasmen.go.id/28650/1/6-PAHLAWAN%20PUTIH.pdf","800 Sastra"
"Pak Abad, pengobat tradisional : cerita rakyat dari Kalimantan Timur","Diyan Kurniawati","Badan Pengembangan dan Pembinaan Bahasa","Jakarta","2017","9786024370893","-","http://repositori.kemendikdasmen.go.id/4158/1/Isi%20Pak%20Abad%2C%20Pengobat%20Tradisional%20comp.pdf","800 Sastra"
"Pak Belalang","Denda Rinjaya","Badan Pengembangan dan Pembinaan Bahasa","Jakarta","2017","9789790692725","-","http://repositori.kemendikdasmen.go.id/4025/1/1129-SD-Pak%20Belalang-Sj-Fiks%20comp.pdf","800 Sastra"
"Pak Belalang: suatu cerita humor Melayu","Maria lndra Rukmi","Proyek Penerbitan Buku Bacaan dan Sastra Indonesia dan Daera","Jakarta","2022","-","-","http://repositori.kemendikdasmen.go.id/24094/1/Pak%20belalang%20suatu%20cerita%20humor%20melayu.PDF","800 Sastra"
"Pakubasa: Peneguh Bahasa dan Sastra di Jawa Barat Edisi September 2017","A Bachtiar","Balai Bahasa Provinsi Jawa Barat","-","2024","-","-","http://repositori.kemendikdasmen.go.id/31187/1/pakubasasept-31102017%282%29.pdf","800 Sastra"
"Pakubasa: peneguh bahasa dan sastra di Jawa Barat, edisi Juni 2024","Balai Bahasa Prov. Jawa Barat Balai Bahasa Provinsi Jawa Barat","Balai Bahasa Provinsi Jawa Barat","Bandung","2026","-","-","http://repositori.kemendikdasmen.go.id/34661/1/PAKUBASA%20Edisi%20Juni%202024.pdf","800 Sastra"
"Pakubasa:Peneguh Bahasa dan Sastra di Jawa Barat, Edisi Desember 2017","A Bahtiar","Balai Bahasa Provinsi Jawa Barat","-","2024","-","-","http://repositori.kemendikdasmen.go.id/31173/1/Pakubasa-Des-draf3-.pdf","800 Sastra"
"Pamali Banjar (2006)","-","BALAI BAHASA BANJARMASIN","-","2017","979 685 558 5","-","http://repositori.kemendikdasmen.go.id/1607/1/Pamali%20Banjar%20%282006%29.pdf","800 Sastra"
"Panak Boru Tiga Bersodara (1996)","Kadirman Saragih Kadirman Saragih","Pusat Pembinaan dan Pengembangan Bahasa","Jakarta","2017","979-459-620-5","-","http://repositori.kemendikdasmen.go.id/1610/1/Panak%20Boru%20Tiga%20Bersodara%20%281996%29.pdf","800 Sastra"
"Pancaran cita : kumpulan cerita pendek dan lukisan","Balai Pustaka Balai Pustaka","Departemen Pendidikan dan Kebudayaan","Jakarta","2022","-","-","http://repositori.kemendikdasmen.go.id/24095/1/PANCARAN%20CITA.pdf","800 Sastra"
"Pandangan Dunia Motinggo Busye 2007 130","Danardana Agus Sri","Pusat Pembinaan dan Pengembangan Bahasa","-","2017","978-979-685-715-9","-","http://repositori.kemendikdasmen.go.id/3282/1/Pandangan%20Dunia%20Motinggo%20Busye%202007%20%20%20%20130.pdf","800 Sastra"
"Pandangan Sastrawan A.A Navis &amp; Tangapan Kritikus Terhadap Karyanya (2003)","Djamari Djamari","-","-","2017","-","-","http://repositori.kemendikdasmen.go.id/1611/1/Pandangan%20Sastrawan%20A.A%20Navis%20%26%20Tangapan%20Kritikus%20Terhadap%20Karyanya%20%282003%29.pdf","800 Sastra"
"Pandawa bermain judi","Yessy Augustin","Direktorat Sejarah dan Nilai Tradisional","Jakarta","2023","-","-","http://repositori.kemendikdasmen.go.id/27244/1/PANDAWA%20BERMAIN%20JUDI.pdf","800 Sastra"
"Pandemi, sekoci, dan beduk Masjid: antologi cerita pendek kelas menulis cerpen","Nur Hidayah","Balai Bahasa Provinsi D.I. Yogyakarta","Yogyakarta","2023","9786239274580","-","http://repositori.kemendikdasmen.go.id/28607/1/5%20Pandemi%20Sekoci%20dan%20bedug%20masjid.pdf","800 Sastra"
"Pangarang Nasjah Djamin Dan Karyanya (1996)","Abdul Murad Abdul Murad","Pusat Pembinaan dan Pengembangan Bahasa","Jakarta","2017","979.459.653.1","-","http://repositori.kemendikdasmen.go.id/1614/1/Pangarang%20Nasjah%20Djamin%20Dan%20Karyanya%20%281996%29.pdf","800 Sastra"
"Pangeran Arja Wicitra (2001)","Ekoyanantiasih Ririen","PUSAT BAHASA DEPARTEMEN PENIDIDIKAN NASIONAL","Jakarta","2017","979-685-167-9","-","http://repositori.kemendikdasmen.go.id/1616/1/Pangeran%20Arja%20Wicitra%20%282001%29.pdf","800 Sastra"
"Pangeran Indra Bangsawan (2000)","Tri Saptarini Tri Saptarini","PUSAT PEMBINAAN DAN PENGEMBANGAN BAHASA","Jakarta","2017","979-459-041-9","-","http://repositori.kemendikdasmen.go.id/1620/1/Pangeran%20Indra%20Bangsawan%202000.pdf","800 Sastra"
"Pangeran Purbaya dan raksasa jin sepanjang : cerita rakyat dari Yogyakarta","Herry Mardiyanto","Badan Pengembangan dan Pembinaan Bahasa","Jakarta","2017","9786024370510","-","http://repositori.kemendikdasmen.go.id/4084/1/Cerita%20Pangeran%20Purbaya%20dan%20Raksasa%20Jin%20Sepanjang%20comp.pdf","800 Sastra"
"Panggal Ujang = Gasing Ujang","Jepri Ardian","Kantor Bahasa Provinsi Banten","Banten","2026","9786235042305","-","http://repositori.kemendikdasmen.go.id/34518/1/%28Cetak%29%20Gasing%20Ujang.pdf","800 Sastra"
"Pangindoan In Tondi Dapot Di Air (1996)","D. Ritonga Baginda Guru D. Ritonga Baginda Guru","Pusat Pembinaan dan Pengembangan Bahasa","Jakarta","2017","979-459-619-1","-","http://repositori.kemendikdasmen.go.id/1639/1/Pangindoan%20In%20Tondi%20Dapot%20Di%20Air%20%281996%29.pdf","800 Sastra"
"Panglima To Dilaling : cerita rakyat dari Sulawesi Barat","Ririen Ekoyanantiasih","Badan Pengembangan dan Pembinaan Bahasa","Jakarta","2020","9786024370176","-","http://repositori.kemendikdasmen.go.id/18941/1/QUGXDPXX_1568863776.pdf","800 Sastra"
"Pangngajak Tomatoa (1992)","Zainuddin Hakim Zainuddin Hakim","Pusat Pembinaan dan Pengembangan Bahasa","Jakarta","2017","979 459 220 X","-","http://repositori.kemendikdasmen.go.id/1640/1/Pangngajak%20Tomatoa%20%281992%29.pdf","800 Sastra"
"Panji Angreni","Subalidinata Subalidinata","Proyek Inventarisasi dan Dokumentasi Sejarah Nasional","Jakarta","2023","-","-","http://repositori.kemendikdasmen.go.id/27257/1/PANJI%20ANGRENI.pdf","800 Sastra"
"Panji balai edisi 14, Juli-- Desember 2022","-","Balai Bahasa Provinsi Jawa Timur","Surabaya","2023","-","-","http://repositori.kemendikdasmen.go.id/27845/1/Panji%20Balai%202022_2.pdf","800 Sastra"
"Panji Dadap I","Sudibyo Z.H. Sudibyo Z.H.","Departemen Pendidikan dan Kebudayaan","Jakarta","2023","-","-","http://repositori.kemendikdasmen.go.id/26687/1/PANJI%20DADAP%20I.pdf","800 Sastra"
"Panji dadap II","Sri Paduka Paku Buwana Ke IV","Departemen Pendidikan dan Kebudayaan","Jakarta","2022","-","-","http://repositori.kemendikdasmen.go.id/24102/1/PANJI%20DADAP%20II.pdf","800 Sastra"
"Panji Kuda Narawangsa","Indri Nitriani","Departemen Pendidikan dan Kebudayaan","Jakarta","2023","-","-","http://repositori.kemendikdasmen.go.id/26689/1/PANJI%20KUDA%20NARAWANGSA.pdf","800 Sastra"
"Panji Sukara (1996)","Lulud Iswadi Lulud Iswadi","Pusat Pembinaan dan Pengembangan Bahasa","Jakarta","2017","979-459-614-0","-","http://repositori.kemendikdasmen.go.id/1649/1/Panji%20Sukara%20%281996%29.pdf","800 Sastra"
"Panji Wulung (1992)","Nurweni Saptawuryandari Nurweni Saptawuryandari","Pusat Pembinaan dan Pengembangan Bahasa","Jakarta","2017","979 459 229 3","-","http://repositori.kemendikdasmen.go.id/1651/1/Panji%20Wulung%20%281992%29.pdf","800 Sastra"
"Panngajarak tu panitra dalam sastra makassar","Abdul Rasyid Abdul Rasyid","Pusat Pembinaan dan Pengembangan Bahasa","-","2017","979-459-923-9","-","http://repositori.kemendikdasmen.go.id/3286/1/Panngajarak%20tu%20panitra%20dalam%20sastra%20makassar.pdf","800 Sastra"
"Pantun (Vaino) masyarakat Kaili","Ratna Amin","Balai Bahasa Sulawesi Tengah","Makassar","2022","9786022631217","-","http://repositori.kemendikdasmen.go.id/24798/2/Pantun%20Vaino.pdf","800 Sastra"
"Pantun Melayu","- -","Departemen Pendidikan dan Kebudayaan","Jakarta","2023","-","-","http://repositori.kemendikdasmen.go.id/26693/1/PANTUN%20MELAYU.pdf","800 Sastra"
"Pantun-Pantun Makasar (1991)","J .S. Sande J.S. Sande","DEPARTEMEN PENDIDIKAN DAN KEBUDAYAAN","Jakarta","2017","979 459 143 2","-","http://repositori.kemendikdasmen.go.id/1654/1/Pantun-Pantun%20Makasar%20%281991%29.pdf","800 Sastra"
"Paparikan Lawe Alih Aksara &amp;Alih Bahasa (1999)","I Made Sudiarga I Made Sudiarga","-","-","2017","-","-","http://repositori.kemendikdasmen.go.id/1655/1/Paparikan%20Lawe%20Alih%20Aksara%20%26Alih%20Bahasa%201999.pdf","800 Sastra"
"Paparikan Lawe Alih Aksara dan Alih Bahasa 1999 386","I Made Sudiarga I Made Sudiarga","Pusat Pembinaan dan Pengembangan Bahasa","-","2017","979-459-932-8","-","http://repositori.kemendikdasmen.go.id/id/eprint/3287","800 Sastra"
"Para penjaga Teluk Youtefa","Dzikry el Han","Badan Pengembangan dan Pembinaan Bahasa","Jakarta","2019","9786024374808","-","http://repositori.kemendikdasmen.go.id/11069/1/Para%20Penjaga%20Teluk%20Youtefa-Dzikry-Final_0.pdf","800 Sastra"
"Paralelisme Bentuk &amp; Makna 1998","Ririen Ekoyanantiasih Ririen Ekoyanantiasih","-","-","2017","-","-","http://repositori.kemendikdasmen.go.id/id/eprint/1656","800 Sastra"
"Parumpamaan di hata Angkola - Mandailing (Tapanuli Selatan)","Ali Hanafiah","Departemen Pendidikan dan Kebudayaan","Jakarta","2022","-","-","http://repositori.kemendikdasmen.go.id/24106/1/PARUMPAMAAN%20DI%20HATA%20ANGKOLA%20-%20MANDAILING.pdf","800 Sastra"
"Pasa : saer-saer Gayo","L.K. Ara","Proyek Penerbitan Buku Bacaan dan Sastra Indonesia dan Daerah","Jakarta","2022","-","-","http://repositori.kemendikdasmen.go.id/24107/1/Pasa.PDF","800 Sastra"
"Pasang Dan Paruntuk Kana Dalam Sastra Klasik Makasar (1992)","Zainuddin Hakim Zainuddin Hakim","Pusal Pembinaan dan Pengembangan Bahasa","Jakarta","2017","979 459 2188","-","http://repositori.kemendikdasmen.go.id/1657/1/Pasang%20Dan%20Paruntuk%20Kana%20Dalam%20Sastra%20Klasik%20Makasar%20%281992%29.pdf","800 Sastra"
"Pasang dan paruntuk kana dalam sastra klasik Makassar","Zainuddin Hakim","Pusat Pembinaan dan Pengembangan Bahasa","Jakarta","2023","9794592188","-","http://repositori.kemendikdasmen.go.id/id/eprint/27478","800 Sastra"
"Pascastrukturalisme: teori, implikasi metodologi, dan contoh analisis","Faruk Faruk","Pusat Bahasa","Jakarta","2022","9789796857524","-","http://repositori.kemendikdasmen.go.id/23778/1/PASCASTRUKTURALISME%20TEORI%2CIMPLIKASI%2CMETODOLOGI%2CDAN%20CONTOH%20APLIKASI.PDF","800 Sastra"
"Pasutri : antologi cerpen bulan bahasa dan sasatra 2007","Pusat Bahasa Pusat Bahasa","Depatemen Pendidikan Nasional","Jakarta","2025","978-979-069-023-3","-","http://repositori.kemendikdasmen.go.id/26496/1/Pasutri%20Antologi%20Cerpen%20Bulan%20Bahasa%20dan%20Sastra%202007.pdf","800 Sastra"
"Pathokaning Nyekaraken","R. Hardjowirogo","Departemen Pendidikan dan Kebudayaan","Jakarta","2022","-","-","http://repositori.kemendikdasmen.go.id/24111/1/PATHOKANING%20NYEKARAKEN.pdf","800 Sastra"
"Pau-Paunna I Mase-Mase Ri Tana Ugi (2000)","Abdul Kadir Mulya Abdul Kadir Mulya","PUSAT BAHASA DEPARTEMEN PENDIDIKAN NASIONAL","JAKARTA","2017","979685 121 0","-","http://repositori.kemendikdasmen.go.id/1658/1/Pau-Paunna%20I%20Mase-Mase%20Ri%20Tana%20Ugi%20%282000%29.pdf","800 Sastra"
"Pecel rengkek Jombangan","Kiki Ratnaning Arimbi","Badan Pengembangan dan Pembinaan Bahasa","Jakarta","2019","9786024374938","-","http://repositori.kemendikdasmen.go.id/id/eprint/11070","800 Sastra"
"Pedoman Penelitian Sastra Daerah (2002)","Abdul Rozak Zaidan Abdul Rozak Zaidan","Departemen Pendidikan Nasional","-","2017","-","-","http://repositori.kemendikdasmen.go.id/1659/1/Pedoman%20%20Penelitian%20Sastra%20Daerah%20%282002%29.pdf","800 Sastra"
"Pedoman Bahasa dan sastra Melayu (1984)","JJ. de Hollander JJ. de Hollander","PN BALAl PUSTAKA","-","2017","-","-","http://repositori.kemendikdasmen.go.id/1660/1/Pedoman%20Bahasa%20dan%20sastra%20Melayu%20%281984%29.pdf","800 Sastra"
"Pedoman dokumentasi Kebahasaan (1983)","Jumariam Jumariam","Pusat Pembinaan dan Pengembangan Bahasa","Jakarta","2017","-","-","http://repositori.kemendikdasmen.go.id/1661/1/Pedoman%20dokumentasi%20Kebahasaan%20%281983%29.pdf","800 Sastra"
"Pedoman Ejaan Bahasa Bali yang Disempurnakan Seri Penyuluhan 4 ( 1977 )","Syarif Thajib Syarif Thajib","Menteri Pedidikan dan Kebudayaan","-","2017","-","-","http://repositori.kemendikdasmen.go.id/id/eprint/1662","800 Sastra"
"Pedoman festival musikalisasi puisi","-","Badan Pengembangan dan Pembinaan Bahasa, Kementerian Pendidikan dan Kebudayaan","Jakarta","2020","9786024374860","-","http://repositori.kemendikdasmen.go.id/17355/1/Pedoman_Festival_Musikalisasi_Puisi.pdf","800 Sastra"
"Pedoman khusus tata Istilah &amp; Tata Nama Kimia(1995)","Saekenl Soedigdo Saekenl Soedigdo","-","-","2017","-","-","http://repositori.kemendikdasmen.go.id/1664/1/Pedoman%20khusus%20tata%20Istilah%20%26%20Tata%20Nama%20Kimia%281995%29.pdf","800 Sastra"
"PEDOMAN PENELITIAN PEMAKAIAN BAHASA","Aslm Gunarwan Aslm Gunarwan","Pusat Bahasa Departemen Pendidikan Nasional","-","2017","979 685 282 9","-","http://repositori.kemendikdasmen.go.id/3289/1/PEDOMAN%20PENELITIAN%20PEMAKAIAN%20BAHASA.pdf","800 Sastra"
"Pedoman Penelitian Sastra Anak (2010)","TOHA-SARUMPAET RIRIS K.","Pusat Bahasa Kementerian Pendidikan Nasional","Jakarta","2017","-","-","http://repositori.kemendikdasmen.go.id/1665/1/Pedoman%20Penelitian%20Sastra%20Anak%20%282010%29.pdf","800 Sastra"
"Pedoman Penelitian Sosiolinguistik","BASUKI SUHARDI BASUKI SUHARDI","Pusat Bahasa Departemen Pendidikan Nasional","-","2017","978-979-685-659-6","-","http://repositori.kemendikdasmen.go.id/3290/1/Pedoman%20Penelitian%20Sosiolinguistik.pdf","800 Sastra"
"Pedoman pengajaran apresiasi novel","Suyadi Hartono","Pusat Pembinaan dan Pengembangan Bahasa","Jakarta","2023","-","-","http://repositori.kemendikdasmen.go.id/27276/1/PEDOMAN%20PENGAJARAN%20APRESIASI%20NOVEL.pdf","800 Sastra"
"Pedoman pengindonesiaan nama dan kata asing","Cacesarius Ruddyanto","Departemen Pendidikan dan Kebudayaan","-","2023","979-459-596-9","-","http://repositori.kemendikdasmen.go.id/id/eprint/28139","800 Sastra"
"PEDOMAN PENGINDONESIAAN NAMA DAN KATA ASING","Hasan Alwi Hasan Alwi","Departemen Pendidikan dan Kebudayaan","-","2017","979-459-596-9","-","http://repositori.kemendikdasmen.go.id/3291/1/PEDOMAN%20PENGINDONESIAAN%20NAMA%20DAN%20KATA%20ASING.pdf","800 Sastra"
"Pedoman penulisan tata bahasa Indonesia","-","Departemen Pendidikan dan Kebudayaan","Jakarta","2023","-","-","http://repositori.kemendikdasmen.go.id/id/eprint/28156","800 Sastra"
"Pedoman Penulisan Tata Bahasa Indonesia (1983)","-","Pusat Pemblnaan dan Pengembangan Bahasa","Jakarta","2017","-","-","http://repositori.kemendikdasmen.go.id/1666/1/Pedoman%20Penulisan%20Tata%20Bahasa%20Indonesia%20%281983%29.pdf","800 Sastra"
"Pedoman Penulisan Tata Bahasa Indonesia 1983 202","Samsuri Samsuri","Pusat Pembinaan dan Pengembangan Bahasa","-","2017","-","-","http://repositori.kemendikdasmen.go.id/3292/1/Pedoman%20Penulisan%20Tata%20Bahasa%20Indonesia%201983%20%20%20%20202.pdf","800 Sastra"
"PEDOMAN PENULISAN-TATA BAHASA INDONESIA","Samsuri Samsuri","Pusat Pembinaan dan Pengembangan Bahasa","-","2017","-","-","http://repositori.kemendikdasmen.go.id/id/eprint/3293","800 Sastra"
"Pedoman penyelenggaraan Bengkel Sastra: puisi","Suwanti Suwanti","Pusat Pembinaan Dan Pengembangan Bahasa Departemen Pendidikan Dan Kebudayaan","Jakarta","2021","979-685-205-5","-","http://repositori.kemendikdasmen.go.id/23603/1/PEDOMAN%20PENYELENGGARAAN%20BENGKEL%20SASTRA%20PUISI.pdf","800 Sastra"
"Pedoman penyelenggaraan penyuluhan bahasa indonesia","zaenal Arifin zaenal Arifin","Pusat Bahasa Departemen Pendidikan Nasional","-","2017","979 685 203 9","-","http://repositori.kemendikdasmen.go.id/3294/1/Pedoman%20penyelenggaraan%20penyuluhan%20bahasa%20indonesia.pdf","800 Sastra"
"Pedoman Penyuluhan Bahasa Indonesia (2008)","Suwamo Suwamo","BALAI BAHASA YOGYAKARTA","-","2017","978-979-8477-27-0","-","http://repositori.kemendikdasmen.go.id/1667/1/Pedoman%20Penyuluhan%20Bahasa%20Indonesia%282008%29.pdf","800 Sastra"
