"judul","penulis","penerbit","kota","tahun","isbn","cover_url","baca_url","kategori"
"Duta bahasa, generasi peduli bangsa","I Gede Sumitra Jaya","Balai Bahasa Provinsi Bali","-","2023","-","-","http://repositori.kemendikdasmen.go.id/25954/1/6.%20Duta%20Bahasa%20Generasi%20Peduli%20Bahasa.mp4","800 Sastra"
"Dwijendra Tattwa","L.B.G Agastia","Direktorat Sejarah dan Nilai Tradisional","Jakarta","2018","-","-","http://repositori.kemendikdasmen.go.id/id/eprint/7777","800 Sastra"
"E-mikuta (komik saku kosakata elektronik): media pembelajaran BIPA berbasis teknologi","Devi Nur Farida (devi.farida1611@gmail.com)","Badan Pengembangan dan Pembinaan Bahasa","Jakarta","2019","-","-","http://repositori.kemendikdasmen.go.id/10060/1/dokumen_makalah_1540532332.pdf","800 Sastra"
"E-modul bahasa Indonesia Kelas X: Melestarikan nilai kearifan lokal melalui cerita rakyat","Ria Andriani","Direktorat Pendidikan Dasar dan Menengah, Direktorat Pembinaan Sekolah Menengan Atas, Kementerian Pendidikan dan Kebudayaan","Jakarta","2020","-","-","http://repositori.kemendikdasmen.go.id/19410/1/Kelas%20X_Bahasa%20Indonesia_KD%203.7.pdf","800 Sastra"
"E-modul bahasa Indonesia Kelas X: membaca buku fiksi dan nonfiksi","Sunarti Sunarti","Direktorat Pendidikan Dasar dan Menengah, Kementerian Pendidikan dan Kebudayaan","Jakarta","2020","-","-","http://repositori.kemendikdasmen.go.id/id/eprint/19408","800 Sastra"
"Ejaan Bahasa Daerah Bali yang Disempurnakan","I Gusti Ngurah Bagus","Lembaga Bahasa Nasional Cabang I","Singaraja","2018","-","-","http://repositori.kemendikdasmen.go.id/7905/1/Ejaan%20Bahasa%20Daerah%20Bali%20yang%20Disempurnakan%201974.pdf","800 Sastra"
"Ejaan.id sebagai inovasi pengeditan naskah berbasis komputerisasi","Ramono Aryo Abilowo","Badan Pengembangan dan Pembinaan Bahasa","Jakarta","2019","-","-","http://repositori.kemendikdasmen.go.id/11049/1/EJAAN.ID%20SEBAGAI%20INOVASI.pdf","800 Sastra"
"Eksistensi bahasa Indonesia di ruang publik","Rina Heryani (rinheryani@yahoo.com)","Badan Pengembangan dan Pembinaan Bahasa","Jakarta","2019","-","-","http://repositori.kemendikdasmen.go.id/11055/1/EKSISTENSI%20BAHASA%20INDONESIA%20DI%20RUANG%20PUBLIK.pdf","800 Sastra"
"Eksistensi Bahasa Indonesia pada industri kuliner Kota Malang","Robiatul Adawiyah (adawiyahrobiatul003@gmail.com)","Badan Pengembangan dan Pembinaan Bahasa","Jakarta","2019","-","-","http://repositori.kemendikdasmen.go.id/10312/1/EKSISTENSI%20BAHASA%20INDONESIA%20PADA%20INDUSTRI.pdf","800 Sastra"
"Ekspetasi Bahasa Indonesia menuju bahasa internasional: telaah kritis pengaruh penyerapan kosakata bahasa asing","Firman Aziz (firman.aziz@upi.edu)","Badan Pengembangan dan Pembinaan Bahasa","Jakarta","2019","-","-","http://repositori.kemendikdasmen.go.id/10993/1/Ekspektasi%20Bahasa%20Indonesia%20Menuju%20Bahasa%20Internasional.pdf","800 Sastra"
"Ekspresi Semiotik : tokoh mitos dan legendaris dalam tutur sastra nusantara di Sumatera Selatan","Muslim M. Soleh Rony","Pusat Pembinaan dan Pengembangan Bahasa","Jakarta","2017","979-459-767-8","-","http://repositori.kemendikdasmen.go.id/id/eprint/1762","800 Sastra"
"Ekspresi: media komunikasi dan informasi, 2007","Marike Nawang Palupi","PPPPTK Bahasa","Jakarta","2021","16933826","-","http://repositori.kemendikdasmen.go.id/21262/1/004-Ekspresi-Edisi-Juni-2007.pdf","800 Sastra"
"Ekstrakurikuler jurnalistik berbasis kecerdasan majemuk sebagai media pendidikan bahasa dan sastra Indonesia","Doni Riadi (doniriadi@gmail.com)","Badan Pengembangan dan Pembinaan Bahasa","Jakarta","2019","-","-","http://repositori.kemendikdasmen.go.id/10983/1/EKSTRAKURIKULER%20JURNALISTIK%20BERBASIS.pdf","800 Sastra"
"Elang dempo menetaskan bujang berkurung di Istana Jelita","Trisman, B. Trisman, B.","Pusat Bahasa","Jakarta","2017","9796854341","-","http://repositori.kemendikdasmen.go.id/2508/1/Elang%20dempo%20menetaskan%20bujang%20berkurung%20di%20istana%20jelita.pdf","800 Sastra"
"Elong Dalam Sastra Bugis","Jemmain Jemmain","Pusat Pembinaan dan Pengembangan Bahasa","Jakarta","2017","979 - 459 - 884 - 4","-","http://repositori.kemendikdasmen.go.id/2509/1/Elong%20dalam%20sastra%20bugis.pdf","800 Sastra"
"Emmy Saelan perempuan di Palagan","Irmawati Puan Mawar","Badan Pengembangan dan Pembinaan Bahasa","Jakarta","2019","9786024375096","-","http://repositori.kemendikdasmen.go.id/id/eprint/10803","800 Sastra"
"Empat wajah: antologi puisi bersama","ZA. Nara Singa","Balai Bahasa Palembang","Palembang","2022","9799627907","-","http://repositori.kemendikdasmen.go.id/26085/1/EMPAT%20WAJAH.pdf","800 Sastra"
"Ensiklopedi musik dan tari daerah Bali","I Made Bandem","Departemen Pendidikan dan Kebudayaan, Proyek Penerbitan Buku Bacaan dan Sastra Indonesia Daerah","Jakarta","2025","-","-","http://repositori.kemendikdasmen.go.id/32103/1/ENSIKLOPEDI%20MUSIK%20DAN%20TARI%20DAERAH%20BALI.PDF","800 Sastra"
"Ensiklopedia Bahasa Sasak","Arman Sufiana","Kantor Bahasa Provinsi NTB","Mataram","2021","-","-","http://repositori.kemendikdasmen.go.id/20494/1/44%20Ensiklopedia%20Bahasa%20Sasak.pdf","800 Sastra"
"Ensiklopedia penulis sastra di Provinsi Banten","Asep Awaludin Gozali","Kantor Bahasa Banten","Serang","2021","-","-","http://repositori.kemendikdasmen.go.id/22603/1/Template-Ensiklopedia-fix-warna.pdf","800 Sastra"
"Ensiklopedia Sastra di Jawa Timur","Anang Santosa","Balai Bahasa Jawa Timur","Sidoarjo","2021","9786028334297","-","http://repositori.kemendikdasmen.go.id/20882/1/ensklopedia%20sastra%20jawa%20imur.pdf","800 Sastra"
"Ensiklopedia sastra Sunda","Wahyu Wibisana","Pusat Pembinaan dan Pengembangan Bahasa","Jakarta","2023","9794597848","-","http://repositori.kemendikdasmen.go.id/27195/1/Cover%20Depan%20Ensiklopedi%20sastra%20sunda-0001.jpg","800 Sastra"
"Erotisme dalam Sastra Jawa Klasik","Titi Mumfaganti","Pusat Bahasa","Jakarta","2017","979 685 186 5","-","http://repositori.kemendikdasmen.go.id/1699/1/Erotisme%20Dalam%20Sastra%20Jawa%20Klasik%20%282001%29.pdf","800 Sastra"
"Es krim istimewa = Es krim istimewa","Dede Nurhalimah","Kantor Bahasa Provinsi Banten","Banten","2026","9786235049724","-","http://repositori.kemendikdasmen.go.id/34524/1/%28Cetak%29%20Es%20Krim%20Istimewa.pdf","800 Sastra"
"Es pelangi","Nursanti Rindiani","Badan Pengembangan dan Pembinaan Bahasa","Jakarta","2020","9786024377366","-","http://repositori.kemendikdasmen.go.id/id/eprint/18236","800 Sastra"
"Farah dan warna merah","Redy Kuswanto","Badan Pengembangan dan Pembinaan Bahasa","Jakarta","2020","9786024377380","-","http://repositori.kemendikdasmen.go.id/18235/1/Farah%20dan%20Warna%20Merah%20%28Redy%20Kuswanto%29.pdf","800 Sastra"
"Fenomena penggunaan bahasa gaul di SMAN 4 Singkawang Kalimantan Barat: suatu tinjauan psikolinguistik","Urai Nancy Andriany","Badan Pengembangan dan Pembinaan Bahasa","Jakarta","2019","-","-","http://repositori.kemendikdasmen.go.id/id/eprint/10205","800 Sastra"
"Fia deuk ngukut! = Fia mau pelihara!","Aan Ansori","Kantor Bahasa Provinsi Banten","Banten","2026","9786235042282","-","http://repositori.kemendikdasmen.go.id/id/eprint/34516","800 Sastra"
"Fiksi dan Non Fiksi dalam Kajian Semiotik","Aart van Zoest","Intermasa","Jakarta","2017","979-8114-33-7","-","http://repositori.kemendikdasmen.go.id/id/eprint/1807","800 Sastra"
"Folklor sastra Minangkabau sebagai identitas keIndonesiaan dan kekuatan kultural di era globalisasi","Sri Rustiyanti (rustiyantisri@yahoo.com)","Badan Pengembangan dan Pembinaan Bahasa","Jakarta","2019","-","-","http://repositori.kemendikdasmen.go.id/10033/1/dokumen_makalah_1540473041.pdf","800 Sastra"
"Fonologi Bahasa Bahaam","Frans Rumbrawer","Departemen Pendidikan dan Kebudayaan","Jakarta","2017","979 459 004 5","-","http://repositori.kemendikdasmen.go.id/4505/1/Fonologi%20Bahasa%20Bahaam%201987.pdf","800 Sastra"
"Fonologi Bahasa Waropen","lisidius animung","Pusat Pembinaan dan Pengembangan Bahasa","Jakarta","2018","-","-","http://repositori.kemendikdasmen.go.id/7908/1/Fonologi%20Bahasa%20Waropen%201994.pdf","800 Sastra"
"Foto Nina, Aa Nino! = Foto Nina, Kak Nino!","Marti Marganingsih","Kantor Bahasa Provinsi Banten","Banten","2026","9786235048109","-","http://repositori.kemendikdasmen.go.id/34617/1/%28Cetak%29%20Foto%20Nina%2C%20Kak%20Nino%21.pdf","800 Sastra"
"Freud dan Interpretasi Sastra","Max Milner","Intermasa","Jakarta","2017","979-8114-84-1","-","http://repositori.kemendikdasmen.go.id/1818/1/Freud%20Dan%20Interpretasi%20Sastra%20%281992%29.pdf","800 Sastra"
"Fuli: Majalah Berbahasa Daerah Maluku. Edisi I Agustus 2013","-","Kantor Bahasa Provinsi Maluku","Ambon","2025","2339-1405","-","http://repositori.kemendikdasmen.go.id/33182/1/FULI%202013.pdf","800 Sastra"
"Fungsi Mantra Dalam Masyarakat Banjar","Tarman Effendi","Pusat Pembinaan dan Pengembangan Bahasa","Jakarta","2017","979-459-678-7","-","http://repositori.kemendikdasmen.go.id/id/eprint/1819","800 Sastra"
"Gadis meor = nona meor = the meor girl","Tabitha Pattean","Kantor Bahasa Provinsi Maluku","Ambon","2022","9786235817019","-","http://repositori.kemendikdasmen.go.id/25694/1/Gadis%20Meor.pdf","800 Sastra"
"Gadis modern","Adlin Affandi","Departemen Pendidikan dan Kebudayaan","Jakarta","2023","-","-","http://repositori.kemendikdasmen.go.id/26975/1/GADIS%20MODERN.pdf","800 Sastra"
"Gadis pelepah pohon enau kumpulan cerita kelahiran ajaib","Mardiyanto Mardiyanto","Pusat Bahasa, Kementerian Pendidikan Nasional","Jakarta","2017","9789790690189","-","http://repositori.kemendikdasmen.go.id/2564/1/GADIS%20PELEPAH%20POHON%20ENAU.pdf","800 Sastra"
"Gala bisa menari","Evi Wahyu Lestari","Kantor Bahasa Provinsi Lampung","Bandar Lampung","2025","-","-","http://repositori.kemendikdasmen.go.id/id/eprint/33740","800 Sastra"
"Galeri luar biasa = Galeri luar biasa","Khaeroyaroh Khaeroyaroh","Kantor Bahasa Provinsi Banten","Banten","2026","9786235042299","-","http://repositori.kemendikdasmen.go.id/34517/1/%28Cetak%29%20Galeri%20Luar%20Biasa.pdf","800 Sastra"
"Gando hilang","Chairul Harun","Direktorat Jenderal Kebudayaan","Jakarta","2021","-","-","http://repositori.kemendikdasmen.go.id/20917/1/GANDO%20HILANG.PDF","800 Sastra"
"Ganongan cilik bumi Ponorogo","Norrattri Norrattri","Badan Pengembangan dan Pembinaan Bahasa","Jakarta","2019","9786024374020","-","http://repositori.kemendikdasmen.go.id/10804/1/Ganongan%20Cilik%20Bumi%20Ponorogo-Norattri-Final.pdf","800 Sastra"
"Gara-gara kelapa: cerita anak dari Lampung","Yunida Evasusanti","Kantor Bahasa Provinsi Lampung","Bandar Lampung","2025","9786235682181","-","http://repositori.kemendikdasmen.go.id/33550/1/22Gara-Gara%20Kelapa_ISBN3.pdf","800 Sastra"
"Gastro kritik: kajian sastra berwawasan kuliner sebagai wahana pengenalan dan pelestarian kuliner nusantara","Binti Mariatul Kiptiyah (bintimaria@gmail.com)","Badan Pengembangan dan Pembinaan Bahasa","Jakarta","2019","-","-","http://repositori.kemendikdasmen.go.id/10024/1/dokumen_makalah_1540518693.pdf","800 Sastra"
"Gaya bahasa dalam meme di media sosial","Dewi Untari (dewi.untari70@gmail.com)","Badan Pengembangan dan Pembinaan Bahasa","Jakarta","2019","-","-","http://repositori.kemendikdasmen.go.id/10207/1/GAYA%20BAHASA%20DALAM%20MEME%20DI%20MEDIA%20SOSIAL.pdf","800 Sastra"
"Gebyar kasusastran: antologi geguritan","Ary Nurdian","Balai Bahasa Provinsi Jawa Timur, Kementerian Pendidikan dan Kebudayaan","Sidoarjo","2022","9786028334419","-","http://repositori.kemendikdasmen.go.id/24755/1/gebyar%20kasusastraan.pdf","800 Sastra"
"Geguritan Arja Wicitra","I Wayan Suarjana","Pusat Pembinaan dan Pengembangan Bahasa","Jakarta","2017","979-459-048-6","-","http://repositori.kemendikdasmen.go.id/1823/1/Geguritan%20Arja%20Wicitra%20%282000%29.pdf","800 Sastra"
"Geguritan Bagus Umbara","I Gusti Ngurah Oka Djelantik","Departemen Pendidikan dan Kebudayaan","Jakarta","2021","-","-","http://repositori.kemendikdasmen.go.id/23521/1/GEGURITAN%20BAGUS%20UMBARA.pdf","800 Sastra"
"Geguritan Brayut","I Nengah Ardika","Direktorat Jenderal Kebudayaan","Jakarta","2018","-","-","http://repositori.kemendikdasmen.go.id/7611/1/GEGURITAN%20BRAYUT.pdf","800 Sastra"
"Geguritan Cilanaya : terjemahan","Cok Istri Oka","Proyek Penerbitan Buku Sastra Indonesia dan Daerah","Jakarta","2021","-","-","http://repositori.kemendikdasmen.go.id/23457/1/Geguritan%20cilanaya.PDF","800 Sastra"
"Geguritan darmakarya","Tasna I Ketut","Proyek Penerbitan Buku Bacaan dan Sastra Indonesia dan Daerah","Jakarta","2024","-","-","http://repositori.kemendikdasmen.go.id/14703/1/Geguritan%20darmakaya.PDF","800 Sastra"
"Geguritan Dharmakerti 1979","I Wayan Tapa","Departemen Pendidikan dan Kebudayaan","Jakarta","2025","-","-","http://repositori.kemendikdasmen.go.id/26216/1/Geguritan%20Dharmakerti%201979.pdf","800 Sastra"
"Geguritan Dukuh Wanasari","I Made Sudiarga","Pusat Pembinaan dan Pengembangan Bahasa","Jakarta","2017","979=459-720-1","-","http://repositori.kemendikdasmen.go.id/1824/1/Geguritan%20Dukuh%20Wanasari%20%281997%29.pdf","800 Sastra"
"Geguritan Dwala","I Made Subandia","Pusat Pembinaan dan Pengembangan Bahasa","Jakarta","2017","97'9-459-535-7","-","http://repositori.kemendikdasmen.go.id/id/eprint/2568","800 Sastra"
"Geguritan I Dukuh Siladri","I Ketut Karyawan","Pusat Pembinaan dan Pengembangan Bahasa","Jakarta","2017","979-459-134-3","-","http://repositori.kemendikdasmen.go.id/1851/1/Geruritan%20I%20Dukuh%20Siladri%20%281991%29.pdf","800 Sastra"
"Geguritan jagat karana","A. A, Alit Dendi","Direktorat Jenderal Kebudayaan","Jakarta","2019","-","-","http://repositori.kemendikdasmen.go.id/id/eprint/13464","800 Sastra"
"Geguritan Jayaprana","Ketut Ginarsa","Departemen Pendidikan dan Kebudayaan","Jakarta","2021","-","-","http://repositori.kemendikdasmen.go.id/id/eprint/23524","800 Sastra"
"Geguritan Kendit Birayung","I Made Subandia","Pusat Pembinaan dan Pengembangan Bahasa","Jakarta","2017","979-459-715-5","-","http://repositori.kemendikdasmen.go.id/id/eprint/1827","800 Sastra"
"Geguritan megantaka","Departemen Pendidikan dan Kebudayaan Departemen Pendidikan dan Kebudayaan","Departemen Pendidikan dan Kebudayaan","Jakarta","2021","http://pustaka.kebudayaan.kemdikbud.go.id/index.php?p=show_detail&id=2767&keywords=Geguritan+MEGANTAKA","-","http://repositori.kemendikdasmen.go.id/23535/1/GEGURITAN%20MEGANTAKA.pdf","800 Sastra"
"Geguritan Mladprana","I Gusti Ngurah Bagus","Pusat Pembinaan dan Pengembangan Bahasa","Jakarta","2017","979-459-217-X","-","http://repositori.kemendikdasmen.go.id/2569/1/Geguritan%20Mladprana.pdf","800 Sastra"
"Geguritan pan bungkling","I Gusti Ngurah Bagus","Departemen Pendidikan dan Kebudayaan","Jakarta","2021","-","-","http://repositori.kemendikdasmen.go.id/23536/1/GEGURITAN%20PAN%20BUNGKLING.pdf","800 Sastra"
"Geguritan Rajapala","I Gusti Ayu Surasmi","Departemen Pendidikan dan Kebudayaan","Jakarta","2021","-","-","http://repositori.kemendikdasmen.go.id/23537/1/Geguritan%20Rajapala.PDF","800 Sastra"
"Geguritan Ratmajawijaya","Nazir Thoir","Departemen Pendidikan dan Kebudayaan","Jakarta","2021","-","-","http://repositori.kemendikdasmen.go.id/23538/1/GEGURITAN%20RATMAJAWIJAYA.pdf","800 Sastra"
"Geguritan rereg Gianyar","Ida Bagus Sidemen","Departemen Pendidikan dan Kebudayaan","Jakarta","2021","-","-","http://repositori.kemendikdasmen.go.id/23539/1/GEGURITAN%20REREG%20GIANYAR.pdf","800 Sastra"
"Geguritan rusak Banjar","I Ketut Pasek Suyasa","Departemen Pendidikan dan Kebudayaan","Jakarta","2021","-","-","http://repositori.kemendikdasmen.go.id/23540/1/Geguritan%20Rusak%20banjar.PDF","800 Sastra"
"Geguritan rusak sasak","Nazir Thoir","Departemen Pendidikan dan Kebudayaan","Jakarta","2021","-","-","http://repositori.kemendikdasmen.go.id/23541/1/GEGURITAN%20RUSAK%20SASAK.pdf","800 Sastra"
"Geguritan Salia","Wayan Jendra","Departemen Pendidikan dan Kebudayaan","Jakarta","2021","-","-","http://repositori.kemendikdasmen.go.id/23542/1/Geguritan%20salia.PDF","800 Sastra"
"Geguritan Sewagati : analisis struktur dan fungsi","Ni Putu Ekatani Negari","Pusat Bahasa","Jakarta","2017","979-685-261-6","-","http://repositori.kemendikdasmen.go.id/1826/1/Geguritan%20Sewagati%20Analisis%20Struktur%20%26%20Fungsi%202002.pdf","800 Sastra"
"Geguritan Tradisional Dalam Sastra Jawa","Titi Mumfangati","Pusat Bahas","Jakarta","2017","979 685 258 6","-","http://repositori.kemendikdasmen.go.id/1830/1/Geguritan%20Tradisional%20Dalam%20Sastra%20Jawa%282002%29.pdf","800 Sastra"
"Geguritan Udiatmika Carita","I Gusti Ngurah Bagus","Pusat Pembinaan dan Pengembangan Bahasa","Jakarta","2017","979-459-132-7","-","http://repositori.kemendikdasmen.go.id/id/eprint/1831","800 Sastra"
"Gelaran Pandu Turunan Pandawa","Muhammad Fanani","Pusat Pembinaan dan Pengembangan Bahasa","Jakarta","2017","979-459-332-X","-","http://repositori.kemendikdasmen.go.id/1832/1/Gelaran%20Pandu%20Turunan%20Pandawa%20%281993%29.pdf","800 Sastra"
"Geliat bahasa dan sastra pada masa pandemi: antologi esai pelatihan penulisan esai bagi generasi muda","Yulianto Yulianto","Balai Bahasa Provinsi D.I. Yogyakarta","Yogyakarta","2023","9786239567552","-","http://repositori.kemendikdasmen.go.id/28608/1/Geliat%20Bahasa%20dan%20Sastra%20pada%20Masa%20Pandemi.pdf","800 Sastra"
"Gending Supir : Pupulan Cerpen Basa Bali","Made Suweta Aryawan","Balai Bahasa Provinsi Bali","Denpasar","2025","9789790691896","-","http://repositori.kemendikdasmen.go.id/26218/1/gending%20supir%20pupulan%20cerpen%20basa%20bali.pdf","800 Sastra"
"Geografi Dialek Bahasa Banjar Hulu","Djantera Kawi","Pusat Pembinaan dan Pengembangan Bahasa","Jakarta","2018","-","-","http://repositori.kemendikdasmen.go.id/7910/1/Geografi%20Dialek%20Bahasa%20Banjar%20Hulu%201980.pdf","800 Sastra"
"Girli 34: lembar komunikasi sastra budaya no. 3, Agustus 2007","Afifah Afifah","Balai Bahasa Yogyakarta","-","2026","-","-","http://repositori.kemendikdasmen.go.id/34834/1/Girli-2007.pdf","800 Sastra"
"Gita Ning Nusa Alit","Djelantik Santha","Pusat Bahasa","Jakarta","2017","979-685-303-5","-","http://repositori.kemendikdasmen.go.id/id/eprint/1852","800 Sastra"
"Glosarium sastra","-","Pusat Bahasa, Departemen Pendidikan Nasional","Jakarta","2017","9796852470","-","http://repositori.kemendikdasmen.go.id/2664/2/Glosarium%20Sastra%20%20%20%20105.pdf","800 Sastra"
"Gol! Gol! Gol! = Gol! Gol! Gol!","Khairul Hakim","Kantor Bahasa Provinsi Banten","Banten","2026","9786340000047","-","http://repositori.kemendikdasmen.go.id/34567/1/%28Cetak%29%20Gol%20Gol%20Gol.pdf","800 Sastra"
"Gong robek yang bertuah : cerita rakyat dari NTB","Zaenal Hakim","Badan Pengembangan dan Pembinaan Bahasa","Jakarta","2017","9786024370411","-","http://repositori.kemendikdasmen.go.id/4186/1/Cerita%20Gong%20Robek%20yang%20Bertuah.pdf","800 Sastra"
"Goresan tinta laskar menoreh: antologi esai bengkel bahasa dan sastra Indonesia siswa SLTA Kabupaten Kulon Progo","Pardi Suratno","Balai Bahasa Daerah Istimewa Yogyakarta","Yogyakarta","2022","9786025228094","-","http://repositori.kemendikdasmen.go.id/24560/1/Goresan%20Tinta%20Laskar%20Menoreh.%20Antologi%20Esai%20Bengkel%20Bahasa%20dan%20Sastra%20Indonesia%20bagi%20Siswa%20SLTA%20Kabupaten%20Kulon%20Progo.pdf","800 Sastra"
"Gunung Sewu UNESCO global geopark","Parno Parno","Badan Pengembangan dan Pembinaan Bahasa","Jakarta","2019","9786024375195","-","http://repositori.kemendikdasmen.go.id/id/eprint/10813","800 Sastra"
"Guru pembelajar modul pelatihan SD Kelas Tinggi: kelompok kompetensi A profesional kajian materi Bahasa dan Sastra Indonesia sekolah dasar","Ariantoni Ariantoni","Direktorat Jenderal Guru dan Tenaga Kependidikan: Direktorat Pembinaan Guru Pendidikan Dasar","Jakarta","2017","-","-","http://repositori.kemendikdasmen.go.id/1043/1/Gabung%20Rekon%20SD%20Tinggi%20kk%20A.ok.pdf","800 Sastra"
"H.B. Jassin dan gema Gorontalo : literasi, lokalitas, dan keIndonesiaan di panggung dunia","Basri Amin","Kantor Bahasa Gorontalo Kementerian Pendidikan Dan Kebudayaan","Gorontalo","2022","9786025328343","-","http://repositori.kemendikdasmen.go.id/23844/1/H.B.JASSIN%20DAN%20GEMA%20GORONTALO.pdf","800 Sastra"
"H.B. Jassin perawat sastra Indonesia","Prih Suharto","Badan Pengembangan dan Pembinaan Bahasa","Jakarta","2019","9786024372637","-","http://repositori.kemendikdasmen.go.id/id/eprint/10827","800 Sastra"
"Habis galau terbitlah gemilang","Ratih Ayu Apsari","Badan Pengembangan dan Pembinaan Bahasa","Jakarta","2019","9786024374969","-","http://repositori.kemendikdasmen.go.id/10818/1/Habis%20Galau%20Terbitlah%20Gemilang-Ratih%20Ayu%20Apsari.pdf","800 Sastra"
"Hadiah istimewa untuk Rania","R. Wusananta Rahardja","Kantor Bahasa Provinsi Lampung","Bandar Lampung","2025","-","-","http://repositori.kemendikdasmen.go.id/33620/1/Hadiah%20istimewa%20untuk%20Rania.pdf","800 Sastra"
"Hahiwang harong nunas","Guspradana Sesridha Alius","Kantor Bahasa Provinsi Lampung","Bandar Lampung","2025","9786239241995","-","http://repositori.kemendikdasmen.go.id/id/eprint/33589","800 Sastra"
"Halimah dan bainai : selalu ada kejutan untuk anak baik","Desy Arisandi","Badan Pengembangan dan Pembinaan Bahasa","Jakarta","2019","9786024374785","-","http://repositori.kemendikdasmen.go.id/10821/1/Halimah%20dan%20Bainai-Desy%20Arisandi-Final.pdf","800 Sastra"
"Hamzah Fansuri dan Nuruddin Ar-Raniri","Saksono Prijanto","Proyek Pengembangan Media Kebudayaan","Jakarta","2023","-","-","http://repositori.kemendikdasmen.go.id/id/eprint/27223","800 Sastra"
"Haroa dari suku Muna dan Buton","Zakridatul Agusmaniar Rane","Badan Pengembangan dan Pembinaan Bahasa","Jakarta","2019","9786024374396","-","http://repositori.kemendikdasmen.go.id/id/eprint/10824","800 Sastra"
"Hayam-hayam Tebe = Ayam-ayam Tebe","Jepri Ardian","Kantor Bahasa Provinsi Banten","Banten","2026","9786235049557","-","http://repositori.kemendikdasmen.go.id/34515/1/%28Cetak%29%20Ayam-ayam%20Tebe.pdf","800 Sastra"
"Hidayatu S-Salikin","-","Pusat Pembinaan dan Pengembangan Bahasa","Jakarta","2017","979-459-215-3","-","http://repositori.kemendikdasmen.go.id/1871/1/Hidayatu%20S-Salikin%20%281992%29.pdf","800 Sastra"
"Hijau kampungku di tengah kota : aku dan belimbing wuluh","Tyas K.W.","Badan Pengembangan dan Pembinaan Bahasa","Jakarta","2019","9786024375119","-","http://repositori.kemendikdasmen.go.id/10828/1/Hijau%20Kampungku%20di%20Tengah%20Kota_0.pdf","800 Sastra"
"Hikayat Abu Sammah","Wiwik P Yusuf","Direktorat Jenderal Kebudayaan","Jakarta","2018","-","-","http://repositori.kemendikdasmen.go.id/7614/1/HIKAYAT%20ABU%20SAMMAH.pdf","800 Sastra"
"Hikayat Ahmad Muhammad","Jumsari Jusuf","Pusat Pembinaan dan Pengembangan Bahasa","Jakarta","2017","979-459-325-7","-","http://repositori.kemendikdasmen.go.id/1872/1/Hikayat%20Ahmad%20Muhamad%20%281993%29.pdf","800 Sastra"
"Hikayat Akhbarul Karim","Ramli Harun","Departemen Pendidikan dan Kebudayaan","Jakarta","2021","-","-","http://repositori.kemendikdasmen.go.id/23573/1/HIKAYAT%20AKHBARUL%20KARIM.pdf","800 Sastra"
"Hikayat Aladin","Amir Mahmud","Pusat Bahasa","Jakarta","2017","979-685-437-6","-","http://repositori.kemendikdasmen.go.id/1873/1/Hikayat%20Aladin%20%282004%29.pdf","800 Sastra"
"Hikayat Amir Hasan dan Amir Husin","Ishak Peutua Gam","Departemen Pendidikan dan Kebudayaan","Jakarta","2021","-","-","http://repositori.kemendikdasmen.go.id/23574/1/HIKAYAT%20AMIR%20HASAN%20DAN%20AMIR%20HUSIN%20ISKAK%20PEUTUA%20GAM.pdf","800 Sastra"
"Hikayat Bayan Budiman","Hani'ah Hani'ah","Pusat Bahasa","Jakarta","2017","979-459-328-1","-","http://repositori.kemendikdasmen.go.id/1874/1/Hikayat%20Bayan%20Budiman%20%282010%29.pdf","800 Sastra"
"Hikayat Bikrama Cindra","Mardiyanto Mardiyanto","Pusat Pembinaan dan Pengembangan Bahasa","Jakarta","2017","979-459-324-9","-","http://repositori.kemendikdasmen.go.id/id/eprint/1875","800 Sastra"
"Hikayat candra hasan","Nikmah Sunardjo","Departemen Pendidikan dan Kebudayaan","Jakarta","2021","-","-","http://repositori.kemendikdasmen.go.id/23575/1/HIKAYAT%20CANDRA%20HASAN.pdf","800 Sastra"
"Hikayat Cindabaya","Jumsari Jusuf","Pusat Pembinaan dan Pengembangan Bahasa","Jakarta","2017","979-459-144-0","-","http://repositori.kemendikdasmen.go.id/1876/1/Hikayat%20Cindabaya%20%281991%29.pdf","800 Sastra"
"Hikayat Datuk Tuan Budian: cerita rakyat Lampung","Susilowati Susilowati","Kantor Bahasa Lampung","Lampung","2021","9786027169364","-","http://repositori.kemendikdasmen.go.id/22616/1/Hikayat-Datuk.pdf","800 Sastra"
"Hikayat Depati Parbo : panglima perang dari sakti alam Kerinci","Rini Febriani","Badan Pengembangan dan Pembinaan Bahasa","Jakarta","2019","9786024372569","-","http://repositori.kemendikdasmen.go.id/10830/1/Hikayat%20Dipati%20Parbo-Rini%20Febriyanti-Final.pdf","800 Sastra"
"Hikayat Eelia tujoh","Ramli Harun","Departemen Pendidikan dan Kebudayaan","Jakarta","2021","-","-","http://repositori.kemendikdasmen.go.id/id/eprint/23576","800 Sastra"
"Hikayat Fadlun dan hikayat perang khaibar","Ramli Harun","Proyek Penerbitan Buku Sastra Indonesia dan Daerah","Jakarta","2021","-","-","http://repositori.kemendikdasmen.go.id/23460/1/Hikayat%20fadlun%20dan%20hikayat%20perang%20khaibar.pdf","800 Sastra"
"Hikayat Galuh Digantung","Nafron Hasjim","Pusat Pembinaan dan Pengembangan Bahasa","Jakarta","2017","-","-","http://repositori.kemendikdasmen.go.id/1877/1/Hikayat%20Galuh%20Digantung%20%281984%29.pdf","800 Sastra"
"Hikayat Gangsa dan Putri Malu: cerita rakyat Lampung","Sarippudin Sarippudin","Kantor Bahasa Lampung","Lampung","2021","9786027169371","-","http://repositori.kemendikdasmen.go.id/22617/1/Hikayat-Gangsa-dan-Putri-Malu.pdf","800 Sastra"
"Hikayat Gulam","Nikmah A. Soenardjo","Pusat Pembinaan dan Pengembangan Bahasa","Jakarta","2017","-","-","http://repositori.kemendikdasmen.go.id/1878/1/Hikayat%20Gulam%20%281978%29.pdf","800 Sastra"
"Hikayat Hang Tuah 1","Bot Genoot Schap","Pusat Bahasa","Jakarta","2017","978-979-069-058-5","-","http://repositori.kemendikdasmen.go.id/1880/1/Hikayat%20Hangtuah%20I%20%282010%29.pdf","800 Sastra"
"Hikayat Hang Tuah 2","Bot Genoop Schap","Pusat Bahasa","Jakarta","2017","978-979-069-058-5","-","http://repositori.kemendikdasmen.go.id/id/eprint/1879","800 Sastra"
"Hikayat hang tuah I","Bot Genoot Schap","Departemen Pendidikan dan Kebudayaan","Jakarta","2021","-","-","http://repositori.kemendikdasmen.go.id/id/eprint/23577","800 Sastra"
